Judge,Year,Court
,2005,Unknown
Hon G. Steven Agee,2005,Supreme Court of Virginia
Hon Leslie M. Alden,2005,4110 Chain Bridge Road
Hon John Richard Alderman,2005,P. O. Box 39
Hon William N. Alexander II,2005,P.O. Box 601
Hon Michael Coghlan Allen,2005,P. O. Box 125
Hon James F. Almand,2005,1425 North Courthouse Road
Hon Joanne F. Alper,2005,1425 North Courthouse Road
Hon Rossie D. Alston Jr.,2005,Circuit Court Chambers
Hon Thomas M. Ammons III,2005,2425 Nimmo Parkway
Hon William Chapman Andrews III,2005,P. O. Box 40
Hon Rosemarie P. Annunziata,2005,Court of Appeals of Virginia
Hon Jonathan M. Apgar,2005,P.O. Box 211
Hon R. Morgan Armstrong,2005,3160 Kings Mountain Road
Hon Isabel Hall Atlee,2005,P. O. Box 630
Hon Daniel T. Balfour,2005,P. O. Box 27032
Hon Rufus A. Banks Jr.,2005,301 Albemarle Drive
Hon William G. Barkley,2005,"501 E. Jefferson Street, Suite 138"
Hon Pamela S. Baskervill,2005,7 Courthouse Avenue
Hon J. Martin Bass,2005,P. O. Box 400
Hon David H. Beck,2005,P. O. Box 400
Hon William Alan Becker,2005,9311 Lee Avenue
Hon Randy I. Bellows,2005,4110 Chain Bridge Road
Hon Ronald Everett Bensten,2005,2501 Huntington Avenue
Hon James W. Benton Jr.,2005,Court of Appeals of Virginia
Hon Edward DeJarnette Berry,2005,350 Park Street
Hon Garland L. Bigley,2005,P. O. Box 188
Hon Harold A. Black,2005,"123 East Main Street, Suite 202"
Hon Richard S. Blanton,2005,P.O. Box 351
Hon Randall M. Blow,2005,"2425 Nimmo Parkway, Building 10"
Hon Joseph Phillips Bounds,2005,315 W. Church Ave. S.W.
Hon Daniel R. Bouton,2005,P. O. Box 230
Hon H. Harrison Braxton Jr.,2005,P. O. Box 940
Hon Janice Justina Brice,2005,9311 Lee Avenue
Hon Lynn S. Brice,2005,P.O. Box 520
Hon William D. Broadhurst,2005,P.O. Box 211
Hon Deborah V. Bryan,2005,"2425 Nimmo Parkway, Building 10"
Hon J. Stephen Buis,2005,Oliver Hill Courts Building
Hon Rudolph Bumgardner III,2005,Court of Appeals of Virginia
Hon Harold W. Burgess Jr.,2005,P.O. Box 520
Hon Francis W. Burkart III,2005,315 W. Church Ave. S.W.
Hon R. Edwin Burnette Jr.,2005,905 Court Street
Hon Theodore J. Burr Jr.,2005,315 South Main Street
Hon James A. Cales Jr.,2005,P. O. Box 1217
Hon J. Colin Campbell Sr.,2005,P.O. Box 128
Hon Louis K. Campbell,2005,P. O. Box 858
Hon Samuel E. Campbell,2005,P.O. Box 280
Hon Andrew Joseph Canada Jr.,2005,2425 Nimmo Parkway
Hon Julia Taylor Cannon,2005,18 East Market Street
Hon M. Randolph Carlson II,2005,800 East City Hall Avenue
Hon Edward K. Carpenter,2005,P. O. Box 47
Hon Gayl Branum Carr,2005,4000 Chain Bridge Road
Hon Harry L. Carrico,2005,Supreme Court of Virginia
Hon Lucretia A. Carrico,2005,35 East Tabb Street
Hon Robert R. Carter,2005,307 Albemarle Drive
Hon Michael Joseph Cassidy,2005,4110 Chain Bridge Road
Hon Bradley B. Cavedo,2005,400 North Ninth Street
Hon Teresa M. Chafin,2005,P. O. Box 65
Hon James H. Chamblin,2005,P. O. Box 550
Hon David Eugene Cheek Sr.,2005,"Safety, Health & Welfare Bldg"
Hon Howard Lee Chitwood,2005,"45 Third Street, N.W."
Hon Martin F. Clark Jr.,2005,P.O. Box 762
Hon Dorothy H. Clarke,2005,1425 North Courthouse Road
Hon Joseph M. Clarke II,2005,315 W. Church Ave. S.W.
Hon Jean Harrison Clements,2005,Court of Appeals of Virginia
Hon Virginia Ladd Cochran,2005,2425 Nimmo Parkway
Hon Sam W. Coleman III,2005,Court of Appeals of Virginia
Hon Frederick H. Combs,2005,P. O. Box 566
Hon A. Christian Compton,2005,Supreme Court of Virginia
Hon H. Vincent Conway Jr.,2005,2500 Washington Avenue
Hon Frederick Hillary Creekmore Sr.,2005,307 Albemarle Drive
Hon Joel Pierson Crowe,2005,P. O. Box 1073
Hon Jesse C. Crumbley III,2005,P. O. Box 97
Hon John R. Cullen,2005,Courthouse Building
Hon Joel C. Cunningham,2005,P. O. Box 458
Hon James F. D'Alton Jr.,2005,7 Courthouse Avenue
Hon Philip V. Daffron,2005,P. O. Box 144
Hon Kimberly J. Daniel,2005,4000 Chain Bridge Road
Hon Bonnie C. Davis,2005,P.O. Box 520
Hon J. Maston Davis,2005,P. O. Box
Hon Mark S. Davis,2005,P. O. Box 1217
Hon Stewart P. Davis,2005,4110 Chain Bridge Road
Hon Nolan Boyd Dawkins,2005,P. O. Box 21461
Hon Susan N. Deatherage,2005,3160 Kings Mountain Road
Hon Jane Pritchard Delbridge,2005,4000 Chain Bridge Road
Hon Rodham T. Delk Jr.,2005,P.O. Box 1814
Hon Ray Wilbur Dezern Jr.,2005,811 East City Hall Avenue
Hon Robert P. Doherty Jr.,2005,2 East Calhoun Street
Hon Charles N. Dorsey,2005,P.O. Box 211
Hon Robert H. Downer Jr.,2005,P. O. Box 2677
Hon Jay Edward Dugger,2005,220 North King Street
Hon Randal J. Duncan,2005,245 South 4th Street
Hon Marvin H. Dunkum,2005,P. O. Box 127
Hon Nelson T. Durden,2005,220 North King Street
Hon Carl Edward Eason Jr.,2005,P.O. Box 1814
Hon Robert B. Edwards,2005,Isle of Wight Courthouse
Hon Larry G. Elder,2005,Court of Appeals of Virginia
Hon Archie Elliott Jr.,2005,P. O. Box 129
Hon Joseph J. Ellis,2005,P.O. Box 157
Hon Dudley J. Emick Jr.,2005,P. O. Box 858
Hon George C. Fairbanks IV,2005,5201 Monticello Avenue
Hon John M. Farmer,2005,Main Street
Hon Kenneth W. Farrar,2005,"901 Church St., 1st Floor"
Hon Lon Edward Farris,2005,9311 Lee Avenue
Hon Walter S. Felton Jr.,2005,Court of Appeals of Virginia
Hon John B. Ferguson,2005,315 W. Church Ave. S.W.
Hon Anita D. Filson,2005,P.O. Box 1336
Hon Gaylord L. Finch Jr.,2005,4110 Chain Bridge Road
Hon Timothy S. Fisher,2005,2500 Washington Avenue
Hon Johanna L. Fitzpatrick,2005,Court of Appeals of Virginia
Hon Charles B. Foley,2005,P. O. Box 458
Hon V. Thomas Forehand Jr.,2005,307 Albemarle Drive
Hon Aundria Deloris Foster,2005,2500 Washington Avenue
Hon Robert P. Frank,2005,Court of Appeals of Virginia
Hon Humes J. Franklin Jr.,2005,P. O. Box 1286
Hon Isaac St. C. Freeman,2005,East Main & Court Streets
Hon Junius P. Fulton III,2005,100 St. Paul's Boulevard
Hon Suzanne Kuczko Fulton,2005,P. O. Box 829
Hon Barbara J. Gaden,2005,John Marshall Courts Building
Hon Thomas E. Gallahue,2005,4110 Chain Bridge Road
Hon J. Michael Gamble,2005,P. O. Box 462
Hon John A. Garrett,2005,P. O. Box 27032
Hon Brett L. Geisler,2005,P. O. Box 218
Hon E. Robert Giammittorio,2005,P. O. Box 20206
Hon Colin R. Gibb,2005,"45 Third Street, NW"
Hon Herbert Cogbill Gill Jr.,2005,P.O. Box 57
Hon Larry E. Gilman,2005,P. O. Box 86
Hon Paul F. Gluchowski,2005,9311 Lee Avenue
Hon S. Bernard Goodwyn,2005,307 Albemarle Drive
Hon G. Carter Greer,2005,P. O. Box 149
Hon Charles D. Griffith Jr.,2005,100 St. Paul's Boulevard
Hon Teena D. Grodner,2005,4000 Chain Bridge Road
Hon Ray Wilson Grubbs,2005,"One East Main Street, Room 418"
Hon Donald M. Haddock,2005,Judges' Chambers
Hon James W. Haley Jr.,2005,P. O. Box 69
Hon William D. Hamblen,2005,Circuit Court Chambers
Hon Catherine C. Hammond,2005,P. O. Box 27032
Hon Edward W. Hanson Jr.,2005,2425 Nimmo Parkway
Hon George W. Harris Jr.,2005,P. O. Box 997
Hon Lee A. Harris Jr.,2005,P. O. Box 27032
Hon G. Blair Harry,2005,P. O. Box 1648
Hon Leroy Rountree Hassell Sr.,2005,Supreme Court of Virginia
Hon Timothy J. Hauler,2005,P.O. Box 57
Hon William O. Hawkins,2005,800 East City Hall Avenue
Hon William D. Heatwole,2005,P. O. Box 1028
Hon Jerry Hendrick Jr.,2005,P.O. Box 520
Hon Karen A. Henenberg,2005,1425 North Courthouse Road
Hon Gary A. Hicks,2005,P. O. Box 27032
Hon Marvin C. Hillsman Jr.,2005,"53 Court Square, Second Floor"
Hon William H. Hodges,2005,Court of Appeals of Virginia
Hon Edward L. Hogshire,2005,315 East High Street
Hon Anne B. Holton,2005,Oliver Hill Courts Building
Hon Thomas B. Hoover,2005,P. O. Box 98
Hon Thomas D. Horne,2005,P. O. Box 550
Hon W. Dale Houff,2005,116 South Court Street
Hon Edward Lewis Hubbard,2005,2500 Washington Avenue
Hon W. Edward Hudgins Jr.,2005,2425 Nimmo Parkway
Hon Melvin R. Hughes Jr.,2005,400 North Ninth Street
Hon James E. Hume,2005,27 East Tabb Street
Hon Robert J. Humphreys,2005,Court of Appeals of Virginia
Hon Dennis Lee Hupp,2005,P. O. Box 406
Hon Pamela E. Hutchens,2005,2425 Nimmo Parkway
Hon Christopher W. Hutton,2005,P. O. Box 40
Hon Michael S. Irvine,2005,Courthouse
Hon Gwendolyn J. Jackson,2005,Room 183
Hon Avelina S. Jacob,2005,18 East Market Street
Hon Jerome James,2005,100 St. Paul's Boulevard
Hon Birdie Hairston Jamison,2005,John Marshall Courts Building
Hon Lawrence Janow,2005,P. O. Box 178
Hon C. N. Jenkins Jr.,2005,Oliver Hill Courts Building
Hon Dwight D. Johnson,2005,350 Park Street
Hon Patrick Reynolds Johnson,2005,Main & Walnut Street
Hon Randall G. Johnson,2005,400 North Ninth Street
Hon J. Samuel Johnston Jr.,2005,P. O. Box 7
Hon Bonnie L. Jones,2005,P. O. Box 70
Hon George A. Jones Jr.,2005,Box 695
Hon Thomas O. Jones,2005,John Marshall Courts Building
Hon Barbara Milano Keenan,2005,Supreme Court of Virginia
Hon M. Langhorne Keith,2005,4110 Chain Bridge Road
Hon Elizabeth Kellas,2005,Judicial Center
Hon Thomas J. Kelley Jr.,2005,1425 North Courthouse Road
Hon D. Arthur Kelsey,2005,Court of Appeals of Virginia
Hon Lisa Bondareff Kemler,2005,Judges' Chambers
Hon Benjamin N. A. Kendrick,2005,1425 North Courthouse Road
Hon John C. Kilgore,2005,104 E. Jackson Street
Hon Colleen K. Killilea,2005,5201 Monticello Avenue
Hon Cynthia D. Kinser,2005,Supreme Court of Virginia
Hon Larry B. Kirksey,2005,Courthouse
Hon Stanley P. Klein,2005,4110 Chain Bridge Road
Hon Judith Anne Kline,2005,2501 Huntington Avenue
Hon John E. Kloch,2005,Judges' Chambers
Hon C. Edward Knight III,2005,P. O. Box 70
Hon Lawrence L. Koontz Jr.,2005,Supreme Court of Virginia
Hon Bruce H. Kushner,2005,307 Albemarle Drive
Hon Elizabeth B. Lacy,2005,Supreme Court of Virginia
Hon James V. Lane,2005,Court Square
Hon Robert D. Laney,2005,P. O. Box 144
Hon Joseph A. Leafe,2005,100 St. Paul's Boulevard
Hon William H. Ledbetter Jr.,2005,P.O. Box 1179
Hon Donald W. Lemons,2005,Supreme Court of Virginia
Hon Louis R. Lerner,2005,P. O. Box 40
Hon R. Larry Lewis,2005,P. O. Box 306
Hon William R. Light,2005,"901 Church St., 1st Floor"
Hon Vincent Austin Lilley,2005,P. O. Box 997
Hon Charles F. Lincoln,2005,109 W. Main St.
Hon William H. Logan Jr.,2005,P. O. Box 228
Hon Eugene E. Lohman,2005,Courthouse
Hon R. Bruce Long,2005,P. O. Box 873
Hon C. Randall Lowe,2005,189 East Main Street
Hon Frederick B. Lowe,2005,2425 Nimmo Parkway
Hon Victor V. Ludwig,2005,P. O. Box 1028
Hon Esther Wiggins Lyles,2005,P. O. Box 925
Hon Kathleen H. MacKay,2005,4110 Chain Bridge Road
Hon Stephen C. Mahan,2005,2425 Nimmo Parkway
Hon Theodore J. Markow,2005,400 North Ninth Street
Hon Ronald Harris Marks,2005,"2425 Nimmo Parkway, Building 10"
Hon Everett Armstrong Martin Jr.,2005,100 St. Paul's Boulevard
Hon George Mason III,2005,P. O. Box 688
Hon Joseph P. Massey,2005,800 East City Hall Avenue
Hon Alfred O. Masters Jr.,2005,"2500 Washington Avenue, Second Floor"
Hon James S. Mathews,2005,811 East City Hall Avenue
Hon Charles James Maxfield,2005,4000 Chain Bridge Road
Hon Burke F. McCahill,2005,P. O. Box 550
Hon Elizabeth A. McClanahan,2005,Court of Appeals of Virginia
Hon Teresa N. McCrimmon,2005,2425 Nimmo Parkway
Hon Richard J. McCue,2005,1425 North Courthouse Road
Hon Donald Patrick McDonough,2005,4110 Chain Bridge Road
Hon John J. McGrath Jr.,2005,Court Square
Hon A. Lee McGratty,2005,113 E. Beverley St. 1st Floor
Hon Michael P. McWeeny,2005,4110 Chain Bridge Road
Hon David A. Melesco,2005,275 South Main Street
Hon Joseph W. Milam Jr.,2005,P. O. Box 3300
Hon B. Bryan Milbourne,2005,P. O. Box 299
Hon Burnett Miller III,2005,P. O. Box 27032
Hon Leroy Francis Millette Jr.,2005,Circuit Court Chambers
Hon Gary A. Mills,2005,2500 Washington Avenue
Hon William J. Minor Jr.,2005,4110 Chain Bridge Road
Hon John Gregory Mooney,2005,P. O. Box 139
Hon Becky J. Moore,2005,P. O. Box 20206
Hon James A. Moore,2005,P. O. Box 1648
Hon Michael Lee Moore,2005,P.O. Box 968
Hon William R. Moore Jr.,2005,P. O. Box 81
Hon William S. Moore Jr.,2005,P. O. Box 1073
Hon Stacey W. Moreau,2005,P. O. Box 270
Hon S. Lee Morris,2005,P. O. Box 129
Hon John C. Morrison Jr.,2005,100 St. Paul's Boulevard
Hon Johnny E. Morrison,2005,P. O. Box 1217
Hon Norman deV. Morrison,2005,P. O. Box 612
Hon Roger L. Morton,2005,135 West Cameron Street
Hon J. Leyburn Mosby Jr.,2005,P. O. Box 4
Hon Thomas Leroy Murphey,2005,P. O. Box 144
Hon Mitchell I. Mutnick,2005,4110 Chain Bridge Road
Hon S. Anderson Nelson,2005,P. O. Box 340
Hon William T. Newman Jr.,2005,1425 North Courthouse Road
Hon R. Terrence Ney,2005,4110 Chain Bridge Road
Hon Kenneth Wilson Nye,2005,100 E. Broadway
Hon Mary Grace O'Brien,2005,9311 Lee Avenue
Hon Kimberly B. O'Donnell,2005,Oliver Hill Courts Building
Hon Ian Michael O'Flaherty,2005,4110 Chain Bridge Road
Hon Eileen Anita Olds,2005,301 Albemarle Drive
Hon Leslie M. Osborn,2005,393 Washington Street
Hon Nelson T. Overton,2005,Court of Appeals of Virginia
Hon Anna Elisabeth Oxenham,2005,P. O. Box 27032
Hon H. Thomas Padrick Jr.,2005,2425 Nimmo Parkway
Hon J. Larry Palmer,2005,100 E. Broadway
Hon Jeffrey W. Parker,2005,40 Culpeper Street
Hon Westbrook J. Parker,2005,P.O. Box 190
Hon Albert W. Patrick III,2005,P. O. Box 70
Hon John A. Paul,2005,53 Court Square
Hon Deborah M. Paxson,2005,"2425 Nimmo Parkway, Building 10"
Hon H. Dudley Payne Jr.,2005,14 Main Street
Hon Paul M. Peatross Jr.,2005,"Court Square, Room 225"
Hon Charles A. Perkinson Jr.,2005,102 East Hicks Street
Hon Mosby Garland Perrow III,2005,P. O. Box 4
Hon David F. Peterson,2005,701 Princess Anne Street
Hon Robert B. Phillips,2005,P. O. Box 276
Hon Gammiel Gray Poindexter,2005,P. O. Box 187
Hon Charles Evans Poston,2005,100 St. Paul's Boulevard
Hon Richard Bowen Potter,2005,Circuit Court Chambers
Hon Cleo E. Powell,2005,P.O. Box 57
Hon Samuel T. Powell III,2005,5201 Monticello Avenue
Hon John R. Prosser,2005,5 North Kent Street
Hon David F. Pugh,2005,2500 Washington Avenue
Hon Robert A. Pustilnik,2005,John Marshall Courts Building
Hon John C. Quigley Jr.,2005,1 East Main St
Hon Michael Miller Rand,2005,P. O. Box 430
Hon Julian H. Raney Jr.,2005,315 W. Church Ave. S.W.
Hon Deborah L. Rawls,2005,"2425 Nimmo Parkway, Building 10"
Hon Merlin M. Renne,2005,P. O. Box 316
Hon Horace A. Revercomb III,2005,9483 Kings Highway #3
Hon Stephen W. Rideout,2005,P. O. Box 21461
Hon Edward A. Robbins Jr.,2005,P.O. Box 520
Hon Angela Edwards Roberts,2005,Oliver Hill Courts Building
Hon James Bailey Robeson,2005,9311 Lee Avenue
Hon Frederick Gore Rockwell III,2005,P.O. Box 57
Hon Alan E. Rosenblatt,2005,2425 Nimmo Parkway
Hon Jane Marum Roush,2005,4110 Chain Bridge Road
Hon Gregory L. Rupe,2005,905 Decatur Street
Hon Charles S. Russell,2005,Supreme Court of Virginia
Hon Timothy K. Sanner,2005,P.O. Box 799
Hon Gordon F. Saunders,2005,150 South Main Street
Hon David Stanford Schell,2005,4000 Chain Bridge Road
Hon John W. Scott Jr.,2005,815 Princess Ann Street
Hon Birg E. Sergent,2005,P. O. Box 326
Hon Joseph Michael Serkes,2005,P. O. Box 514
Hon Thomas S. Shadrick,2005,2425 Nimmo Parkway
Hon William W. Sharp,2005,P. O. Box 1618
Hon W. Allan Sharrett,2005,P. O. Box 631
Hon William H. Shaw III,2005,P.O. Box 576
Hon Louis Allen Sherman,2005,Room 183
Hon A. Bonwill Shockley,2005,2425 Nimmo Parkway
Hon James Michael Shull,2005,Courthouse
Hon Charles F. Sievers,2005,9311 Lee Avenue
Hon Mark C. Simmons,2005,4110 Chain Bridge Road
Hon Ann Hunter Simpson,2005,P.O. Box 895
Hon Robert L. Simpson Jr.,2005,2425 Nimmo Parkway
Hon Joan C. Skeppstrom,2005,800 East City Hall Avenue
Hon Lorraine Nordlund Skipper,2005,4110 Chain Bridge Road
Hon N. Prentis Smiley Jr.,2005,P. O. Box 371
Hon Dennis J. Smith,2005,4110 Chain Bridge Road
Hon James H. Smith,2005,P. O. Box 357
Hon Robert J. Smith,2005,4110 Chain Bridge Road
Hon Beverly W. Snukals,2005,400 North Ninth Street
Hon Denis F. Soden,2005,P. O. Box 27032
Hon Frank W. Somerville,2005,P. O. Box 821
Hon Valentine W. Southall Jr.,2005,P. O. Box 24
Hon Margaret Poles Spencer,2005,400 North Ninth Street
Hon Peter W. Steketee,2005,9311 Lee Avenue
Hon Roscoe B. Stephenson Jr.,2005,Supreme Court of Virginia
Hon John R. Stevens,2005,P. O. Box 180
Hon L. Neil Steverson,2005,P. O. Box 27032
Hon M. Lee Stilwell Jr.,2005,P.O. Box 3300
Hon David T. Stitt,2005,4110 Chain Bridge Road
Hon Charles M. Stone,2005,P.O. Box 1347
Hon Walter W. Stout III,2005,400 North Ninth Street
Hon Charles J. Strauss,2005,P.O. Box 1042
Hon J. Robert Stump,2005,P.O. Box 1980
Hon Bryant L. Sugg,2005,2500 Washington Avenue
Hon James R. Swanson,2005,305 East Main Street
Hon Dean W. Sword Jr.,2005,P. O. Box 1217
Hon Jacqueline F. Ward Talevi,2005,315 W. Church Ave. S.W.
Hon Harry T. Taliaferro III,2005,P. O. Box 1000
Hon Alfreda Talton-Harris,2005,P. O. Box 1648
Hon Joseph S. Tate,2005,109 West Main Street
Hon Joi Jeter Taylor,2005,John Marshall Courts Building
Hon Lydia Calvert Taylor,2005,100 St. Paul's Boulevard
Hon Ramona D. Taylor,2005,"2425 Nimmo Parkway, Building 10"
Hon Richard D. Taylor Jr.,2005,Tenth & Hull Streets
Hon Wilford Taylor Jr.,2005,P. O. Box 40
Hon C. Peter Tench,2005,2500 Washington Avenue
Hon Jonathan C. Thacher,2005,4110 Chain Bridge Road
Hon Norman A. Thomas,2005,100 St. Paul's Boulevard
Hon James L. Tompkins III,2005,Courthouse
Hon Winship C. Tower,2005,"2425 Nimmo Parkway, Building 10"
Hon Wenda Kavanagh Travers,2005,9311 Lee Avenue
Hon Peter L. Trible,2005,P. O. Box 176
Hon Alfred M. Tripp,2005,Room 160
Hon Philip Trompeter,2005,Courthouse Bldg
Hon Malfourd W.  Bo Trumbo,2005,P. O. Box 670
Hon Paul A. Tucker,2005,150 South Main Street
Hon Robert M. D. Turk,2005,"One East Main Street, Room 409"
Hon Edward M. Turner III,2005,P.O. Box 698
Hon Glen Allen Tyler,2005,P.O. Box 126
Hon James W. Updike Jr.,2005,123 East Main St.
Hon Michael J. Valentine,2005,4000 Chain Bridge Road
Hon Henry A. Vanover,2005,Box 190
Hon George D. Varoutsos,2005,P. O. Box 925
Hon Thomas L. Vaughn,2005,P. O. Box 144
Hon Robert C. Viar Jr.,2005,1 East Main Street
Hon Arthur B. Vieregg Jr.,2005,4110 Chain Bridge Road
Hon Philip Arthur Wallace,2005,123 East Main Street
Hon Charles H. Warren,2005,911 Madison Street
Hon Junius P. Warren,2005,P. O. Box 751
Hon Thomas V. Warren,2005,P.O. Box 62
Hon Jacqueline R. Waymack,2005,100 East Broadway
Hon Clifford R. Weckstein,2005,P.O. Box 211
Hon William L. Wellons,2005,11435 Courthouse Road
Hon Patricia L. West,2005,2425 Nimmo Parkway
Hon John E. Wetsel Jr.,2005,5 North Kent Street
Hon Herman A. Whisenant Jr.,2005,Circuit Court Chambers
Hon David Shaw Whitacre,2005,Judicial Center
Hon A. Ellen White,2005,P. O. Box 220
Hon Colon H. Whitehurst,2005,307 Albemarle Drive
Hon Susan L. Whitlock,2005,P. O. Box 452
Hon Morton V. Whitlow,2005,P. O. Box 129
Hon Bruce A. Wilcox,2005,Room 160
Hon Dale M. Wiley,2005,P. O. Box 3300
Hon Sharon B. Will,2005,P. O. Box 27032
Hon David L. Williams,2005,307 Albemarle Drive
Hon David Victor Williams,2005,Suite B
Hon Gino W. Williams,2005,1 East Main St
Hon Keary R. Williams,2005,P.O. Box 849
Hon Marcus D. Williams,2005,4110 Chain Bridge Road
Hon Stuart L. Williams Jr.,2005,P. O. Box 27032
Hon William P. Williams,2005,800 East City Hall Avenue
Hon Alotha C. Willis,2005,P. O. Box 1073
Hon Gordon F. Willis,2005,P. O. Box 339
Hon Jere M.H. Willis Jr.,2005,Court of Appeals of Virginia
Hon Larry D. Willis,2005,301 Albemarle Drive
Hon Elizabeth S. Wills,2005,P. O. Box 2320
Hon Robert B. Wilson V,2005,220 North King Street
Hon Thomas H. Wood,2005,P. O. Box 689
Hon Robert G. Woodson Jr.,2005,P. O. Box 24
Hon Gene A. Woolard,2005,2425 Nimmo Parkway
Hon Robert W. Wooldridge Jr.,2005,4110 Chain Bridge Road
Hon Dean S. Worcester,2005,18 East Market Street
Hon Timothy S. Wright,2005,307 Albemarle Drive
Hon Archer L. Yeatts III,2005,P. O. Box 27032
,2005,Unknown
Mr Ronald S. Albright,2005,Roanoke City General District Court
Hon Beverly R. Anderson,2005,Lee Circuit Court
Ms Terry Jean Andrews,2005,Caroline Juvenile & Domestic Relations District Court
Hon A. Nicole Armentrout,2005,Waynesboro Circuit Court
Ms Stacey T. Arrington,2005,Bedford Juvenile & Domestic Relations District Court
Hon Gayle Ashworth,2005,Essex Circuit Court
Ms Katherine Malley Aylor,2005,Stafford Juvenile & Domestic Relations District Court
Ms Jill G. Baker,2005,Bland Combined District and JD & R Court
Ms Jacqueline Michelle Balderson,2005,Waynesboro General District Court
Mr Thomas E. Baldwin Sr.,2005,Norfolk General District Court
Hon Gail H. Barb,2005,Fauquier Circuit Court
Hon Denise F. Barb,2005,Shenandoah Circuit Court
Mr Christopher Eric Barr,2005,Alexandria Juvenile & Domestic Relations District Court
Ms Ruth P. Bates,2005,Roanoke County Juvenile & Domestic Relations District Court
Ms Linda M. Beatty,2005,Warren Juvenile & Domestic Relations District Court
Ms Christine C. Beck,2005,Carroll Combined District and JD & R Court
Hon David A. Bell,2005,Arlington Circuit Court
Ms Judy R. Bell,2005,Floyd Combined District and JD & R Court
Hon Jim M. Bevins Jr.,2005,Buchanan Circuit Court
Hon Carol W. Black,2005,Bedford Circuit Court
Ms Gloria M. Blankenship,2005,Powhatan Combined District and JD & R Court
Hon James E. Blevins,2005,Tazewell Circuit Court
Ms Sandra Cox Blount,2005,Richmond-Civil General District Court
Hon Malcolm Booker Jr.,2005,Buckingham Circuit Court
Ms Donna Coffey Bosserman,2005,Augusta Juvenile & Domestic Relations District Court
Ms Donna Coffey Bosserman,2005,Staunton Juvenile & Domestic Relations District Court
Hon Peggy A. Bostic,2005,Craig Circuit Court
Ms Debra C. Bostic,2005,Radford Combined District and JD & R Court
Ms Teresa B. Bowden,2005,Isle of Wight Juvenile & Domestic Relations District Court
Mr Richard H. Bowling,2005,Richmond-Criminal General District Court
Ms Jane Carter Branson,2005,Westmoreland General District Court
Ms Brenda C. Brown,2005,Suffolk General District Court
Ms Janet L. Brown,2005,Culpeper Combined District and JD & R Court
Ms Wanda E. Brownlee,2005,Richmond County Combined District and JD & R Court
Ms Jacqueline Preston Brubaker,2005,Franklin County General District Court
Ms Barbara S. Brubaker,2005,Page General District Court
Ms Jacqueline Preston Brubaker,2005,Pittsylvania General District Court
Hon Diane Bruce,2005,Rappahannock Circuit Court
Ms Michele Joyce Bryant,2005,Patrick Juvenile & Domestic Relations District Court
Ms Debra V. Bull,2005,Warren General District Court
Ms Kyra Lynn Bullock,2005,Spotsylvania General District Court
Hon Allan C. Burke,2005,Montgomery Circuit Court
Ms Lisa Demaris Burnett,2005,Wythe Juvenile & Domestic Relations District Court
Hon Karen A. Butler,2005,New Kent Circuit Court
Hon Helen Butts,2005,Clarke Circuit Court
Ms Marie S. Cagwin,2005,New Kent General District Court
Hon E. E. Callis III,2005,Mathews Circuit Court
Ms Martha L. Campbell,2005,Lexington/Rockbridge Combined District and JD & R Court
Hon Ray S. Campbell Jr.,2005,Caroline Circuit Court
Ms C. Sue Canady,2005,Portsmouth Juvenile & Domestic Relations District Court
Hon Darlene W. Carpenter,2005,Bath Circuit Court
Hon W. R. Carter Jr.,2005,Suffolk Circuit Court
Hon Gwynne J. Chatham,2005,Westmoreland Circuit Court
Ms Ellen Taylor Chiasson,2005,Prince George Combined District and JD & R Court
Ms Theresa A. Childress,2005,Roanoke County General District Court
Ms Judith C. Childress,2005,Pulaski Juvenile & Domestic Relations District Court
Ms Deborah R. Childress,2005,Dickenson Combined District and JD & R Court
Ms Monica Arlene Christian,2005,Clarke General District Court
Hon Gail P. Clayton,2005,Surry Circuit Court
Hon Gary M. Clemens,2005,Loudoun Circuit Court
Ms S. Lynn Coates,2005,Westmoreland Juvenile & Domestic Relations District Court
Hon Christopher W. Coleman,2005,Buena Vista Circuit Court
Ms Veresia W. Coleman,2005,Halifax General District Court
Hon E. E. Coleman Jr.,2005,Mecklenburg Circuit Court
Ms Ellen S. Collier,2005,Greene Combined District and JD & R Court
Ms Connie S. Comer,2005,Tazewell General District Court
Hon Dollie M. Compton,2005,Russell Circuit Court
Hon Robert W. Conner,2005,Halifax Circuit Court
Ms Heather Dawn Cooper,2005,Lynchburg Juvenile & Domestic Relations District Court
Hon Samuel H. Cooper Jr.,2005,Accomack Circuit Court
Ms Cindy S. Cornwell,2005,Madison Combined District and JD & R Court
Hon Wayne M. Cosby,2005,Southampton Circuit Court
Hon Kathy P. Crane,2005,Washington Circuit Court
Hon Chance Crawford,2005,Salem Circuit Court
Ms Deborah K. Daughtrey,2005,Richmond Juvenile & Domestic Relations District Court
Hon Rex A. Davis,2005,Newport News Circuit Court
Hon John B. Davis,2005,Augusta Circuit Court
Ms Dee Balderson Davis,2005,Essex Combined District and JD & R Court
Ms Patricia Marie Davis,2005,Rappahannock Combined District and JD & R Court
Hon Bevill M. Dean,2005,Richmond Circuit Court
Hon Bevill M. Dean,2005,Richmond Manchester Circuit Court
Hon Barbara G. Decatur,2005,Stafford Circuit Court
Ms Edna Sparrer DeChristopher,2005,York Juvenile & Domestic Relations District Court
Ms Nancy P. Derrick,2005,Nottoway Combined District and JD & R Court
Ms V. Jane Dorton,2005,Wise Juvenile & Domestic Relations District Court
Ms Ellen K. Douglas,2005,Northumberland General District Court
Ms Kelly Anne Douglas,2005,New Kent Juvenile & Domestic Relations District Court
Hon Sue K. Dudley,2005,Highland Circuit Court
Hon Marie C. Durrer,2005,Greene Circuit Court
Mr Michael Dwayne Edwards,2005,Scott Combined District and JD & R Court
Mr Charles Thomas Elliott,2005,Henrico Juvenile & Domestic Relations District Court
Ms Robin Lynne Elliott,2005,Fluvanna Combined District and JD & R Court
Hon Machelle J. Epps,2005,Prince Edward Circuit Court
Hon Gordon F. Erby,2005,Lunenburg Circuit Court
Ms Patsy A. Ewell,2005,Newport News Juvenile & Domestic Relations District Court
Hon Stuart B. Fallen,2005,Charlotte Circuit Court
