Judge,Year,Court
Hon Eugene C. Wingfield,2017,Lynchburg Circuit Court
Hon Leeta D. Louk,2017,Madison Circuit Court
Hon Ashby R. Pritchett,2017,Martinsville Circuit Court
Hon Angela Ingram,2017,Mathews Circuit Court
Hon Michelle Gordon,2017,Mecklenburg Circuit Court
Hon Lynn L. Dunlevy,2017,Middlesex Circuit Court
Hon Erica W. Williams,2017,Montgomery Circuit Court
Hon Lisa Dugan Bryant,2017,Nelson Circuit Court
Hon Amy P. Crump,2017,New Kent Circuit Court
Hon Gary S. Anderson,2017,Newport News Circuit Court
Hon George E. Schaefer,2017,Norfolk Circuit Court
Hon Traci L. Johnson,2017,Northampton Circuit Court
Hon Deborah Bingham,2017,Northumberland Circuit Court
Hon Jane L. Brown,2017,Nottoway Circuit Court
Hon Teresa T. Carroll,2017,Orange Circuit Court
Hon C. Grayson Markowitz,2017,Page Circuit Court
Hon Vicki S. Reece,2017,Patrick Circuit Court
Hon Shalva J. Braxton,2017,Petersburg Circuit Court
Hon Mark W. Scarce,2017,Pittsylvania Circuit Court
Hon Cynthia P. Morrison,2017,Portsmouth Circuit Court
Hon Teresa Hash Dobbins,2017,Powhatan Circuit Court
Hon Machelle J. Eppes,2017,Prince Edward Circuit Court
Hon Bishop Knott Jr.,2017,Prince George Circuit Court
Hon Jacqueline C. Smith,2017,Prince William Circuit Court
Hon Maetta H. Crewe,2017,Pulaski Circuit Court
Hon Ann Howard,2017,Radford Circuit Court
Hon Margaret Ralph,2017,Rappahannock Circuit Court
Hon Edward F. Jewett,2017,Richmond Circuit Court
Hon Cheryl B. Pierson,2017,Richmond County Circuit Court
Hon Brenda S. Hamilton,2017,Roanoke City Circuit Court
Hon Steven A. McGraw Sr.,2017,Roanoke County Circuit Court
Hon D. Bruce Patterson,2017,Rockbridge Circuit Court
Hon Chaz W. Haywood,2017,Rockingham Circuit Court
Hon Ann Sword McReynolds,2017,Russell Circuit Court
Hon Chance Crawford,2017,Salem Circuit Court
Hon Mark A. (Bo) Taylor,2017,Scott Circuit Court
Hon Sarona S. Irvin,2017,Shenandoah Circuit Court
Hon John H. Graham,2017,Smyth Circuit Court
Hon Richard L. Francis,2017,Southampton Circuit Court
Hon Christalyn M. Jett,2017,Spotsylvania Circuit Court
Hon Kathy M. Sterne,2017,Stafford Circuit Court
Hon Thomas E. Roberts,2017,Staunton Circuit Court
Hon W. R. Carter Jr.,2017,Suffolk Circuit Court
Hon Gail P. Clayton,2017,Surry Circuit Court
Hon Gary M. Williams,2017,Sussex Circuit Court
Hon Tammy B. Allison,2017,Tazewell Circuit Court
Ms Deborah Jane Gardner,2017,Suffolk General District Court
Hon Tina E. Sinnen,2017,Virginia Beach Circuit Court
Hon Daryl L. Funk,2017,Warren Circuit Court
Hon Tricia S. Moore,2017,Washington Circuit Court
Hon Nicole A. Briggs,2017,Waynesboro Circuit Court
Hon Gwynne J. Chatham,2017,Westmoreland Circuit Court
Hon Mona A. Foley,2017,Williamsburg/James City County Circuit Court
Hon Terry H. Whittle,2017,Winchester Circuit Court
Hon J. Jack Kennedy Jr.,2017,Wise Circuit Court
Hon Hayden H. Horney,2017,Wythe Circuit Court
Hon Kristen N Nelson,2017,York County Poquoson Circuit Court
Ms Francina Violet Chisum,2017,Accomack General District Court
Ms Crystal L. Byers,2017,Albemarle General District Court
Ms Marion W. Jackson,2017,Alexandria General District Court
Ms Beverly J. Lewis,2017,Amherst General District Court
Ms Jeannie Watin Hamlet,2017,Appomattox General District Court
Mr Steven Robert Spurr,2017,Arlington General District Court
Ms Christy D. Hostetter,2017,Augusta General District Court
Ms Ashley Richards Schley,2017,Bedford General District Court
Mrs Paula Jean Perkins,2017,Bristol General District Court
Ms Amy Showalter Leftwich,2017,Campbell General District Court
Ms Terry M. Southworth,2017,Caroline General District Court
Ms Donna Webb Ayers,2017,Carroll General District Court
Ms Sabrina Herzig Powell,2017,Charlotte General District Court
Ms Mary Alice Trimble,2017,Charlottesville General District Court
Ms Barbara C. Shaw,2017,Chesapeake General District Court
Mrs Linda J McCollum-Moore,2017,Chesterfield General District Court
Ms Melanie L. Hoffman,2017,Clarke General District Court
Ms Brenda D. Leber,2017,Colonial Heights General District Court
Ms Cheryl Lee Phillips,2017,Culpeper General District Court
Ms Julie H. Carlisle,2017,Danville General District Court
Mr Kevin W. Bailey,2017,Fairfax City General District Court
Mr Christopher Eric Barr,2017,Fairfax County General District Court
Ms Erica Ashley Gatchell,2017,Fauquier General District Court
Ms Jacqueline Preston Brubaker,2017,Franklin County General District Court
Ms Laura Leanne Hatch,2017,Fredericksburg General District Court
Ms Debra V. Bull,2017,Frederick/Winchester General District Court
Ms Amy S. Pierce,2017,Gloucester General District Court
Ms Veresia R. Wood,2017,Halifax General District Court
Ms Barbara K. Fagley,2017,Hampton General District Court
Ms Connie S. Comer,2017,Tazewell General District Court
Ms Cheryl Lynn DeVaughn,2017,Hanover General District Court
Ms Teresa Lynn Brown,2017,Harrisonburg/Rockingham General District Court
Ms Linda Susan Knight,2017,Henrico General District Court
Ms Stacie Renae Prillaman,2017,Henry General District Court
Ms Keith F. Daniel,2017,Isle of Wight General District Court
Ms Jill C. Hall,2017,King William General District Court
Ms Jill C. Hall,2017,King and Queen General District Court
Ms Christina E Headley,2017,Lancaster General District Court
Ms Marilyn Hostetter McCurdy,2017,Lexington/Rockbridge General District Court
Ms Tammy Hummer Dinterman,2017,Loudoun General District Court
Ms Brandy S Alexander,2017,Louisa General District Court
Ms Wetawna G. Hays,2017,Lynchburg General District Court
Ms Stacie Renae Prillaman,2017,Martinsville General District Court
Ms Dorothy Gail Fulcher,2017,Mathews General District Court
Ms Tammy Tollerson Taylor,2017,Mecklenburg General District Court
Ms Dorothy Gail Fulcher,2017,Middlesex General District Court
Ms Kimberly W. McKittrick,2017,Montgomery General District Court
Ms Rosemary R. North,2017,Nelson General District Court
Ms Sirena Kestner,2017,New Kent General District Court
Ms Karen J. Routten,2017,Newport News-Civil General District Court
,2017,Newport News-Criminal General District Court
,2017,Newport News-Traffic General District Court
Mr Thomas E. Baldwin Sr.,2017,Norfolk General District Court
Ms Karen Sparrow Merritt,2017,Northampton General District Court
Ms Angela W Tadlock,2017,Northumberland General District Court
Ms Amanda Nicole Taylor,2017,Page General District Court
Ms Brenda S. Hines,2017,Patrick General District Court
Ms Dana Helm Shannon,2017,Petersburg General District Court
Ms Jacqueline Preston Brubaker,2017,Pittsylvania General District Court
Mr James Michael Verschueren,2017,Portsmouth General District Court
Ms Jacqueline R. Ward,2017,Prince William General District Court
Ms Sharon H. Collins,2017,Pulaski General District Court
Ms Sandra Cox Blount,2017,Richmond-Civil General District Court
Ms Rebecca Schmidt,2017,Richmond-John Marshall Criminal-Traffic General District Court
Ms Carol Bowman Kennedy,2017,Richmond-Marsh Criminal-Traffic at Manchester General District Court
Mr Rick S. Kahl,2017,Roanoke City General District Court
Ms Carol E. Camacho,2017,Roanoke County General District Court
Ms Tamara L. Heishman,2017,Shenandoah General District Court
Ms Heidi Zumpf Campbell,2017,Smyth General District Court
Ms Kyra Lynn Bullock,2017,Spotsylvania General District Court
Ms Bonnie Lee Camp,2017,Stafford General District Court
Ms Amanda M Knighting,2017,Staunton General District Court
Mr David M. O'Dell,2017,Virginia Beach General District Court
Ms Pamela S. Kidwell,2017,Warren General District Court
Ms Stephanie M Swift,2017,Washington General District Court
Ms Jacqueline Michelle Balderson,2017,Waynesboro General District Court
Mrs Laura Standbridge Morgan,2017,Westmoreland General District Court
Ms Karen D.K. Snyder,2017,Williamsburg/James City County General District Court
Ms Debra V. Bull,2017,Winchester/Frederick General District Court
Ms Jean C. Sparks,2017,Wise/Norton General District Court
Ms Vicki E. Tate,2017,Wythe General District Court
Ms Melanie H. Stephens,2017,York General District Court
Mr Roland Clifton Leighton,2017,Accomack Juvenile & Domestic Relations District Court
Ms Stephanie Michelle Lawson,2017,Albemarle Juvenile & Domestic Relations District Court
Ms Dominika Anna Bui,2017,Alexandria Juvenile & Domestic Relations District Court
Ms Karen Coleman King,2017,Amherst Juvenile & Domestic Relations District Court
Ms Jessie T Lloyd,2017,Appomattox Juvenile & Domestic Relations District Court
Ms Amy K. Burnham,2017,Arlington Juvenile & Domestic Relations District Court
Ms Teresa L. Smith,2017,Augusta Juvenile & Domestic Relations District Court
Ms Stacey T. Arrington,2017,Bedford Juvenile & Domestic Relations District Court
Ms Kathy J. Melvin,2017,Bristol Juvenile & Domestic Relations District Court
Ms Deborah Megginson Jones,2017,Campbell Juvenile & Domestic Relations District Court
Ms Kristie Gail Compton,2017,Caroline Juvenile & Domestic Relations District Court
Ms Diana Quesenberry Smith,2017,Carroll Juvenile & Domestic Relations District Court
Ms Brittany Pillow Bradley,2017,Charlotte Juvenile & Domestic Relations District Court
Ms Stephanie Michelle Lawson,2017,Charlottesville Juvenile & Domestic Relations District Court
Mrs Marisa J. Norman,2017,Chesapeake Juvenile & Domestic Relations District Court
Ms Laura Gardner Griffin,2017,Chesterfield Juvenile & Domestic Relations District Court
Ms Sherri Allen,2017,Clarke Juvenile & Domestic Relations District Court
Ms Evelyn Hall,2017,Colonial Heights Juvenile & Domestic Relations District Court
Ms Bethany Ann McClanahan,2017,Culpeper Juvenile & Domestic Relations District Court
Ms Tammy Calloway White,2017,Danville Juvenile & Domestic Relations District Court
Ms Barbara Suini Moran,2017,Fairfax County Juvenile & Domestic Relations District Court
Ms Lois C. Welch,2017,Fauquier Juvenile & Domestic Relations District Court
Ms Billie Jo Wagner,2017,Franklin County Juvenile & Domestic Relations District Court
Ms Joan M. Millward,2017,Fredericksburg Juvenile & Domestic Relations District Court
Ms Ann B. Lloyd,2017,Frederick/Winchester Juvenile & Domestic Relations District Court
Ms Deanna L McKinnon,2017,Gloucester Juvenile & Domestic Relations District Court
Ms Catherine H. Ratliff,2017,Halifax Juvenile & Domestic Relations District Court
Ms Judith D. Reed,2017,Hampton Juvenile & Domestic Relations District Court
Ms Susan S. Wood,2017,Hanover Juvenile & Domestic Relations District Court
Ms Terri Denise Rea,2017,Harrisonburg/Rockingham Juvenile & Domestic Relations District Court
Ms Shanda Renee Ellis,2017,Henrico Juvenile & Domestic Relations District Court
Ms Nora A. Green,2017,Henry Juvenile & Domestic Relations District Court
Ms Teresa B. Bowden,2017,Isle of Wight Juvenile & Domestic Relations District Court
Ms Shannon Flinchum Meadowcroft,2017,King William Juvenile & Domestic Relations District Court
Ms Shannon Flinchum Meadowcroft,2017,King and Queen Juvenile & Domestic Relations District Court
Ms Linda Paige Jacobs,2017,Lancaster Juvenile & Domestic Relations District Court
Mr Gregory C. Hemmings,2017,Lexington/Rockbridge Juvenile & Domestic Relations District Court
Ms Evamari Bates,2017,Loudoun Juvenile & Domestic Relations District Court
Ms Toni P. Seay,2017,Louisa Juvenile & Domestic Relations District Court
Ms Heather Hall Stevens,2017,Lynchburg Juvenile & Domestic Relations District Court
Ms Teresa D. Renz,2017,Martinsville Juvenile & Domestic Relations District Court
Ms Deanna L McKinnon,2017,Mathews Juvenile & Domestic Relations District Court
Ms Rebecca D. Inge,2017,Mecklenburg Juvenile & Domestic Relations District Court
Ms Deanna L McKinnon,2017,Middlesex Juvenile & Domestic Relations District Court
Ms Amie B. Blankenship,2017,Montgomery Juvenile & Domestic Relations District Court
Ms Nancy H. Massie,2017,Nelson Juvenile & Domestic Relations District Court
Ms Kelly Douglas Wiggins,2017,New Kent Juvenile & Domestic Relations District Court
Ms Patsy A. Ewell,2017,Newport News Juvenile & Domestic Relations District Court
Ms Debra A. Hill,2017,Norfolk Juvenile & Domestic Relations District Court
Ms Francine W. Williams,2017,Northampton Juvenile & Domestic Relations District Court
Ms Linda Paige Jacobs,2017,Northumberland Juvenile & Domestic Relations District Court
Ms Joyce M Carr,2017,Page Juvenile & Domestic Relations District Court
Ms Michele Joyce Bryant,2017,Patrick Juvenile & Domestic Relations District Court
Ms Beneatha B. Simmons,2017,Petersburg Juvenile & Domestic Relations District Court
Ms Sherrie D. Lester,2017,Pittsylvania Juvenile & Domestic Relations District Court
Ms Lois M. Furnish,2017,Portsmouth Juvenile & Domestic Relations District Court
Ms Frances H. Hedrick,2017,Prince William Juvenile & Domestic Relations District Court
Ms Anne Elizabeth Helms,2017,Pulaski Juvenile & Domestic Relations District Court
Ms Patricia R. Batley,2017,Richmond Juvenile & Domestic Relations District Court
Ms Carolyn W. Robbins,2017,Roanoke City Juvenile & Domestic Relations District Court
Ms Debra Shelor Barbour,2017,Roanoke County Juvenile & Domestic Relations District Court
Ms Nikki Wymer Taylor,2017,Shenandoah Juvenile & Domestic Relations District Court
Ms Stephanie N. Daniels,2017,Smyth Juvenile & Domestic Relations District Court
Ms Susan Ann Klingensmith,2017,Spotsylvania Juvenile & Domestic Relations District Court
Mr James Bruce Thompson,2017,Stafford Juvenile & Domestic Relations District Court
Ms Teresa L. Smith,2017,Staunton Juvenile & Domestic Relations District Court
Mrs Sandra K. Perrin,2017,Suffolk Juvenile & Domestic Relations District Court
Ms Connie Cheryl Roberts,2017,Tazewell Juvenile & Domestic Relations District Court
Ms Pamela Scott,2017,Virginia Beach Juvenile & Domestic Relations District Court
Ms Shanna Lane Henry,2017,Warren Juvenile & Domestic Relations District Court
Ms Brooke P Conway,2017,Washington Juvenile & Domestic Relations District Court
Ms Donna Coffey Bosserman,2017,Waynesboro Juvenile & Domestic Relations District Court
Ms Christina Anne Viviers,2017,Westmoreland Juvenile & Domestic Relations District Court
Ms Shea S Bruno,2017,Williamsburg/James City County Juvenile & Domestic Relations District Court
Ms Ann B. Lloyd,2017,Winchester/Frederick Juvenile & Domestic Relations District Court
Ms Susannah C Wells,2017,Wise Juvenile & Domestic Relations District Court
Ms Karen L. Akers,2017,Wythe Juvenile & Domestic Relations District Court
Ms Margienette J. Whitfield,2017,York Juvenile & Domestic Relations District Court
Ms Susan S. Hutchison,2017,Alleghany Combined Court
Ms Melissa B. Gil,2017,Amelia Combined Court
Ms Mikayo Ayako Curtis,2017,Bath Combined Court
Ms Jill G. Baker,2017,Bland Combined Court
Ms Bonnie D. Simmons,2017,Botetourt Combined Court
Ms Susan Evans Martin,2017,Brunswick Combined Court
Ms Judith M. Lyall,2017,Buchanan Combined Court
Ms Dana Lynn Franklin,2017,Buckingham Combined Court
Ms Ginger L. Webb,2017,Buena Vista Combined Court
Ms Barbara Jean Watkins,2017,Charles City Combined Court
Ms Patricia H Taylor,2017,Craig Combined Court
Ms Jennifer May Clayton,2017,Cumberland Combined Court
Ms Deborah Ann Childress,2017,Dickenson Combined Court
Ms Lisa G. Coleman,2017,Dinwiddie Combined Court
Ms Sandra Andleton Ligon,2017,Emporia Combined Court
Ms Dee Balderson Davis,2017,Essex Combined Court
Ms Lekha Lamma,2017,Falls Church Combined Court
Ms Judy R. Bell,2017,Floyd Combined Court
Ms Kimberly Ann Warner,2017,Fluvanna Combined Court
Ms Mariah C. Belcher,2017,Franklin City Combined Court
Ms Amanda Sawyers Stoneman,2017,Galax Combined Court
Ms Yvette M. Pennington,2017,Giles Combined Court
Ms Dianne Henley White,2017,Goochland Combined Court
Ms Autumn C Hawks,2017,Grayson Combined Court
Ms Barbara Brill Berry,2017,Greene Combined Court
Ms Sandra Andleton Ligon,2017,Greensville Combined Court
Ms Victoria L King,2017,Highland Combined Court
Ms Ellen Taylor Chiasson,2017,Hopewell Combined Court
Ms Nancy Lynn Tierney,2017,King George Combined Court
Ms Sammie R. Horton,2017,Lee Combined Court
Mrs Danelle W. Bagley,2017,Lunenburg Combined Court
Ms Wendy Shifflette Gallihugh,2017,Madison Combined Court
Ms Mary R. Childress,2017,Nottoway Combined Court
Ms Barbara B Miller,2017,Orange Combined Court
Ms Michelle A. Soukup,2017,Powhatan Combined Court
Ms Vickie C. Talbott,2017,Prince Edward Combined Court
Ms Denise Riddle Covington,2017,Prince George Combined Court
Ms Sally Stump Davis,2017,Radford Combined Court
Ms Patricia Marie Davis,2017,Rappahannock Combined Court
Ms Wanda F. Brownlee,2017,Richmond County Combined Court
Ms Kathy F. Vance,2017,Russell Combined Court
Ms Brandy Ann Duncan,2017,Salem Combined Court
Ms Karen D. Hood,2017,Scott Combined Court
Ms Belinda J. Jones,2017,Southampton Combined Court
Ms Janeen L Jackson,2017,Surry Combined Court
Ms Faye Parham Yelverton,2017,Sussex Combined Court
,2017,Unknown
Mr. Robert Frank Noote IV,2017,First Judicial District
Ms. Laura Eve Tsai,2017,Second Judicial District
Ms. Amanda Josephine Winchester,2017,Third Judicial District
VACANT,2017,"Fourth, and 2A Judicial Districts"
Mr. Sean Patrick Dolan,2017,Fifth Judicial District
Mr. Neill Collins Bradley,2017,Sixth Judicial District
Mr. Valla Vonga Olliver II,2017,Seventh and Eighth Judicial Districts
Ms. M. Virginia Munoz,2017,Ninth Judicial District
Mr. Christopher Alexander Salerno,2017,Tenth Judicial District
Ms. Jennifer Elizabeth Chapman,2017,Eleventh Judicial District
Mr. Daniel John Holser,2017,Twelfth Judicial District
Mr. Gary Michael Wooldridge,2017,Thirteenth Judicial District
Ms. Yvette A. Ayala,2017,Fourteenth Judicial District
Mr. Clifford Yarborough Rose,2017,Fifteenth Judicial District
Ms. Avnel Alair Coates,2017,Sixteenth Judicial District
Mr. Bruce Charles Adam,2017,Seventeenth Judicial District
Mr. Adam Dominic Willard,2017,Eighteenth Judicial District
Mr. Claude J. Beheler,2017,Nineteenth Judicial District
Mr. Lawrence D. Black,2017,Twentieth Judicial District
Ms. Ann M.S. Hylton,2017,Twenty-first Judicial District
Ms. Joyce Williamson Crews,2017,Twenty-second Judicial District
Mr. Stephen Daniel Poff,2017,Twenty-third Judicial District
Mr. Andrew John Michael,2017,Twenty-fourth Judicial District
Ms. Robyn Renee Wilhelm,2017,Twenty-fifth Judicial District
Ms. Monica Lynne Martin,2017,Twenty-sixth Judicial District
Ms. Jill M. Long,2017,Twenty-seventh Judicial District
Ms. Mary Johanna Hanzlik,2017,Twenty-eighth Judicial District
Mr. Jonathan Wayne Robbins,2017,Thirtieth Judicial District
Ms. Lawrie Falck Moncure,2017,Thirty-first Judicial District
,2018,Unknown
Hon Robert L Adams Jr.,2018,Danville General District Court
Hon Bruce D. Albertson,2018,Rockingham Circuit Court
Hon Timothy W. Allen,2018,Franklin County Juvenile and Domestic Relations District Court
Hon Rossie D. Alston Jr.,2018,Court of Appeals of Virginia
Hon Rosemarie P. Annunziata,2018,Court of Appeals of Virginia
Hon Marjorie T. Arrington,2018,Chesapeake Circuit Court
Hon J. Gregory Ashwell,2018,P. O. Box 458
Hon Clifford Lynwood Athey Jr.,2018,Clarke Circuit Court
Hon Kimberly Marion Athey,2018,Frederick/Winchester Juvenile and Domestic Relations District Court
Hon Michelle J. Atkins,2018,Norfolk Circuit Court
Hon Richard Y. AtLee Jr.,2018,Court of Appeals of Virginia
Hon Penney S. Azcarate,2018,Fairfax Circuit Court
Hon Anthony Wayne Bailey,2018,Harrisonburg/Rockingham Juvenile and Domestic Relations District Court
Hon D. Scott   Bailey,2018,Prince William Juvenile and Domestic Relations District Court
Hon C. Ridley Bain,2018,Brunswick General District and Juvenile and Domestic Relations District Court
Hon Lisa Michelle Baird,2018,Prince William Juvenile and Domestic Relations District Court
Hon Rufus A. Banks Jr.,2018,Chesapeake Circuit Court
Hon William G. Barkley,2018,Albemarle General District Court
Hon David M Barredo,2018,Albemarle Juvenile and Domestic Relations District Court
Hon Henry A. Barringer,2018,Tazewell General District Court
Hon Alfred W. Bates III,2018,Suffolk General District Court
Hon Randolph A. Beales,2018,Court of Appeals of Virginia
Hon Robert Beman Beasley Jr.,2018,Powhatan General District and Juvenile and Domestic Relations District Court
Hon Randy I. Bellows,2018,Fairfax Circuit Court
Hon Jeffrey P. Bennett,2018,Amherst Juvenile and Domestic Relations District Court
Hon Ronald Everett Bensten,2018,Newport News Juvenile and Domestic Relations District Court
Hon David   Bernhard,2018,Fairfax Circuit Court
Hon Kevin C. Black,2018,"215 Mill Rd., Suite 228"
Hon Donald Carl Blessing,2018,Prince Edward Circuit Court
Hon Stephen D. Bloom,2018,Greensville General District and Juvenile and Domestic Relations District Court
Hon Randall M. Blow,2018,Virginia Beach Juvenile and Domestic Relations District Court
Hon J. D. Bolt,2018,Galax General District and Juvenile and Domestic Relations District Court
Hon B. Elliott Bondurant,2018,New Kent Circuit Court
Hon Thomas O. Bondurant Jr.,2018,Henrico General District Court
Hon Wade A. Bowie,2018,York Juvenile and Domestic Relations District Court
Hon Joel R. Branscom,2018,Botetourt Circuit Court
Hon Lynn S. Brice,2018,Chesterfield Circuit Court
Hon Marcus A. Brinks,2018,Patrick General District Court
Hon George Robert Brittain II,2018,Tazewell General District Court
Hon William D. Broadhurst,2018,Roanoke City Circuit Court
Hon Jan L. Brodie,2018,Fairfax Circuit Court
Hon Pamela L. Brooks,2018,Loudoun Juvenile and Domestic Relations District Court
Hon John W. Brown,2018,Chesapeake Circuit Court
Hon Deborah V. Bryan,2018,Virginia Beach Juvenile and Domestic Relations District Court
Hon Neil Randolph Bryant,2018,Frederick Circuit Court
Hon Richard S. Buddington Jr.,2018,Smyth Juvenile and Domestic Relations District Court
Hon Tanya   Bullock,2018,Virginia Beach Juvenile and Domestic Relations District Court
Hon Francis W. Burkart III,2018,Roanoke City General District Court
Hon R. Edwin Burnette Jr.,2018,Lynchburg Circuit Court
Hon Elizabeth Kellas Burton,2018,Frederick/Winchester Juvenile and Domestic Relations District Court
Hon Michael J. Bush,2018,Russell General District and Juvenile and Domestic Relations District Court
Hon Robert L. Bushnell,2018,Martinsville Juvenile and Domestic Relations District Court
Hon J. Frank Buttery Jr.,2018,Loudoun General District Court
Hon David B. Caddell Jr.,2018,Hanover General District Court
Hon Hugh S. Campbell,2018,Hanover General District Court
Hon Richard B. Campbell,2018,Richmond Juvenile and Domestic Relations District Court
Hon Lawrence B. Cann III,2018,Richmond-Civil General District Court
Hon Harry Michael Cantrell,2018,Fairfax County General District Court
Hon Manuel A. Capsalis,2018,Fairfax County General District Court
Hon Claire G. Cardwell,2018,Richmond-Civil General District Court
Hon M. Randolph Carlson II,2018,Norfolk Juvenile and Domestic Relations District Court
Hon Thomas W. Carpenter,2018,Newport News Juvenile and Domestic Relations District Court
Hon D. Gregory   Carr,2018,Chesterfield Juvenile and Domestic Relations District Court
Hon Gayl Branum Carr,2018,Fairfax County Juvenile and Domestic Relations District Court
Hon Grace Burke Carroll,2018,Fairfax Circuit Court
Hon David B. Carson,2018,Roanoke City Circuit Court
Hon Theresa W. Carter,2018,Culpeper General District Court
Hon Michael Joseph Cassidy,2018,Fairfax County General District Court
Hon Bradley B. Cavedo,2018,Richmond Circuit Court
Hon Paul W. Cella,2018,Powhatan Circuit Court
Hon Teresa M. Chafin,2018,Court of Appeals of Virginia
Hon David Eugene Cheek Sr.,2018,Richmond-Marsh Criminal/Traffic General District Court at Manchester
Hon H. Lee Chitwood,2018,Pulaski Juvenile and Domestic Relations District Court
Hon George Barton Chucker,2018,Henrico General District Court
Hon Leisa K. Ciaffone,2018,Roanoke County Juvenile and Domestic Relations District Court
Hon Bruce A. Clark Jr.,2018,Hopewell General District and Juvenile and Domestic Relations District Court
Hon James C. Clark,2018,Alexandria Circuit Court
Hon Martin F. Clark Jr.,2018,Patrick Circuit Court
Hon Stan D. Clark,2018,Suffolk Juvenile and Domestic Relations District Court
Hon Glenn L. Clayton II,2018,Fairfax County Juvenile and Domestic Relations District Court
Hon William Harrison Cleaveland,2018,Botetourt General District and Juvenile and Domestic Relations District Court
Hon J. Christopher Clemens,2018,Roanoke City Circuit Court
Hon Jean Harrison Clements,2018,Court of Appeals of Virginia
Hon Robert P. Coleman,2018,Prince William General District Court
Hon Cressondra B. Conyers,2018,Gloucester Juvenile and Domestic Relations District Court
Hon John T. Cook,2018,Campbell Circuit Court
Hon W. Parker Councill,2018,Isle of Wight General District Court
Hon Wallace Semeon Covington III,2018,Prince William General District Court
Hon Monica D. Cox,2018,Carroll Juvenile and Domestic Relations District Court
Hon Glenn R. Croshaw,2018,Virginia Beach Circuit Court
Hon Joel P. Crowe,2018,Portsmouth Circuit Court
Hon Melissa N. Cupp,2018,Fauquier Juvenile and Domestic Relations District Court
Hon Bradley G Dalton,2018,Floyd General District and Juvenile and Domestic Relations District Court
Hon Uley Norris Damiani,2018,Alexandria Juvenile and Domestic Relations District Court
Hon Kimberly J. Daniel,2018,Fairfax County Juvenile and Domestic Relations District Court
Hon Laura L. Dascher,2018,Alleghany General District and Juvenile and Domestic Relations District Court
Hon S. Clark Daugherty,2018,Norfolk General District Court
Hon Nolan B. Dawkins,2018,Alexandria Circuit Court
Hon Susan N. Deatherage,2018,Henry Juvenile and Domestic Relations District Court
Hon Marla Graff Decker,2018,Court of Appeals of Virginia
