Judge,Year,Court
Hon J. Stephen Buis,2014,Richmond Juvenile and Domestic Relations District Court
Hon Tanya   Bullock,2014,Virginia Beach Juvenile and Domestic Relations District Court
Hon Rudolph   Bumgardner III,2014,Court of Appeals of Virginia
Hon Harold W. Burgess Jr.,2014,Chesterfield Circuit Court
Hon Francis W. Burkart III,2014,Roanoke City General District Court
Hon R. Edwin Burnette Jr.,2014,Lynchburg General District Court
Hon Karen J. Burrell,2014,Norfolk Circuit Court
Hon Elizabeth Kellas Burton,2014,Frederick/Winchester Juvenile and Domestic Relations District Court
Hon Michael J. Bush,2014,Russell General District and Juvenile and Domestic Relations District Court
Hon Robert L. Bushnell,2014,P. O. Box 751
Hon J. Frank Buttery Jr.,2014,Loudoun General District Court
Hon Hugh S. Campbell,2014,Hanover General District Court
Hon Richard B. Campbell,2014,Richmond Juvenile and Domestic Relations District Court
Hon Lawrence B. Cann,2014,Richmond-Criminal General District Court
Hon M. Randolph Carlson II,2014,Norfolk Juvenile and Domestic Relations District Court
Hon Edward K. Carpenter,2014,Goochland General District and Juvenile and Domestic Relations District Court
Hon Thomas W. Carpenter,2014,Newport News Juvenile and Domestic Relations District Court
Hon D. Gregory   Carr,2014,Chesterfield Juvenile and Domestic Relations District Court
Hon Gayl Branum Carr,2014,Fairfax County Juvenile and Domestic Relations District Court
Hon David B. Carson,2014,Roanoke City Circuit Court
Hon Michael Joseph Cassidy,2014,Fairfax County General District Court
Hon Bradley B. Cavedo,2014,Richmond Circuit Court
Hon Paul W. Cella,2014,Powhatan Circuit Court
Hon Teresa M. Chafin,2014,Court of Appeals of Virginia
Hon David Eugene Cheek Sr.,2014,Richmond-Criminal General District Court
Hon H. Lee Chitwood,2014,Pulaski Juvenile and Domestic Relations District Court
Hon George Barton Chucker,2014,Henrico General District Court
Hon Leisa K. Ciaffone,2014,Roanoke County Juvenile and Domestic Relations District Court
Hon Bruce A. Clark Jr.,2014,Hopewell General District and Juvenile and Domestic Relations District Court
Hon James C. Clark,2014,Alexandria Circuit Court
Hon Martin F. Clark Jr.,2014,Patrick Circuit Court
Hon Joseph M. Clarke II,2014,Roanoke City Juvenile and Domestic Relations District Court
Hon Richard A. Claybrook Jr.,2014,Harrisonburg/Rockingham General District Court
Hon Glenn L. Clayton II,2014,Fairfax County Juvenile and Domestic Relations District Court
Hon William Harrison Cleaveland,2014,Botetourt General District and Juvenile and Domestic Relations District Court
Hon J. Christopher Clemens,2014,Roanoke City General District Court
Hon Jean Harrison Clements,2014,Court of Appeals of Virginia
Hon Sam W. Coleman III,2014,Court of Appeals of Virginia
Hon H. Vincent Conway Jr.,2014,Newport News Circuit Court
Hon Cressondra B. Conyers,2014,Gloucester Juvenile and Domestic Relations District Court
Hon John T. Cook,2014,Campbell Circuit Court
Hon W. Parker Councill,2014,Isle of Wight General District Court
Hon Monica D. Cox,2014,Carroll Juvenile and Domestic Relations District Court
Hon Glenn R. Croshaw,2014,Virginia Beach Circuit Court
Hon Joel P. Crowe,2014,Portsmouth Juvenile and Domestic Relations District Court
Hon Joel C. Cunningham,2014,Halifax Circuit Court
Hon Uley Norris Damiani,2014,Alexandria Juvenile and Domestic Relations District Court
Hon Kimberly J. Daniel,2014,Fairfax County Juvenile and Domestic Relations District Court
Hon Laura L. Dascher,2014,Alleghany General District and Juvenile and Domestic Relations District Court
Hon S. Clark Daugherty,2014,"811 East City Hall Avenue, Room 160"
Hon Bonnie C. Davis,2014,Chesterfield Juvenile and Domestic Relations District Court
Hon Nolan B. Dawkins,2014,Alexandria Circuit Court
Hon Susan N. Deatherage,2014,Henry Juvenile and Domestic Relations District Court
Hon Marla Graff Decker,2014,Court of Appeals of Virginia
Hon Margaret W. Deglau,2014,Henrico Juvenile and Domestic Relations District Court
Hon Sarah L. Deneke,2014,Stafford Circuit Court
Hon George M. DePolo,2014,Prince William Juvenile and Domestic Relations District Court
Hon Michael F. Devine,2014,Fairfax Circuit Court
Hon Louise M. DiMatteo,2014,Arlington Circuit Court
Hon Phillip T. DiStanislao,2014,Petersburg Juvenile and Domestic Relations District Court
Hon Charles N. Dorsey,2014,Roanoke City Circuit Court
Hon Chadwick S. Dotson,2014,Wise Circuit Court
Hon Robert H. Downer Jr.,2014,Charlottesville General District Court
Hon John R. Doyle III,2014,Norfolk Circuit Court
Hon Jay Edward Dugger,2014,Hampton Juvenile & Domestic Relations District Court
Hon Randal J. Duncan,2014,Montgomery General District Court
Hon Marvin H. Dunkum,2014,Buckingham General District and Juvenile and Domestic Relations District Court
Hon Dale B. Durrer,2014,Culpeper General District Court
Hon Carl Edward Eason Jr.,2014,Suffolk Circuit Court
Hon Sam D. Eggleston III,2014,Campbell General District Court
Hon Joseph J. Ellis,2014,Spotsylvania Circuit Court
Hon George C. Fairbanks IV,2014,Williamsburg/James City County Juvenile and Domestic Relations District Court
Hon Kenneth W. Farrar,2014,Lynchburg Juvenile and Domestic Relations District Court
Hon Lon Edward Farris,2014,Prince William Circuit Court
Hon Walter S. Felton Jr.,2014,Court of Appeals of Virginia
Hon Anita D. Filson,2014,"20 South Randolph Street, Suite 201"
Hon Bradley W. Finch,2014,Radford General District and Juvenile and Domestic Relations District Court
Hon Phillip U. Fines,2014,Spotsylvania Juvenile and Domestic Relations District Court
Hon Daniel S. Fiore II,2014,Arlington Circuit Court
Hon Timothy S. Fisher,2014,Newport News Circuit Court
Hon V. Thomas Forehand Jr.,2014,Chesapeake Circuit Court
Hon Robert P. Frank,2014,Court of Appeals of Virginia
Hon Constance H. Frogale,2014,Alexandria Juvenile and Domestic Relations District Court
Hon Steven C. Frucci,2014,Virginia Beach Circuit Court
Hon Junius P. Fulton III,2014,Norfolk Circuit Court
Hon Barbara J. Gaden,2014,Richmond-Civil General District Court
Hon Thomas E. Gallahue,2014,Fairfax County General District Court
Hon J. Michael Gamble,2014,Amherst Circuit Court
Hon Richard E. Gardiner,2014,Fairfax County General District Court
Hon Michael T. Garrett,2014,Amherst Juvenile and Domestic Relations District Court
Hon Brett L. Geisler,2014,Carroll Circuit Court
Hon Edwin A. Gendron Jr.,2014,Henry General District Court
Hon Colin R. Gibb,2014,Pulaski Circuit Court
Hon William C. Goodwin,2014,Staunton General District Court
Hon S. Bernard Goodwyn,2014,Supreme Court of Virginia
Hon Croxton   Gordon,2014,Northampton Juvenile & Domestic Relations District Court
Hon Marilynn C. Goss,2014,Richmond Juvenile and Domestic Relations District Court
Hon Mayo K. Gravatt,2014,Nottoway General District and Juvenile and Domestic Relations District Court
Hon G. Carter Greer,2014,Martinsville Circuit Court
Hon M. Woodrow Griffin Jr.,2014,Hampton General District Court
Hon Teena D. Grodner,2014,Fairfax County Juvenile and Domestic Relations District Court
Hon Donald M. Haddock Jr.,2014,Alexandria General District Court
Hon Phillip L. Hairston,2014,Richmond-Criminal General District Court
Hon James W. Haley Jr.,2014,Court of Appeals of Virginia
Hon Mary Jane   Hall,2014,Norfolk Circuit Court
Hon Jeffrey   Hamilton,2014,Scott General District and Juvenile and Domestic Relations District Court
Hon Catherine C. Hammond,2014,Henrico Circuit Court
Hon Teresa N. Hammons,2014,Virginia Beach General District Court
Hon Edward W. Hanson Jr.,2014,Virginia Beach Circuit Court
Hon H. Lee Harrell,2014,Carroll General District Court
Hon J. Overton Harris,2014,Hanover Circuit Court
Hon Lee A. Harris Jr.,2014,Henrico Circuit Court
Hon Robert Louis Harrison Jr.,2014,Bedford Juvenile and Domestic Relations District Court
Hon Timothy J. Hauler,2014,Chesterfield Circuit Court
Hon James C. Hawks,2014,Portsmouth Circuit Court
Hon Tonya   Henderson-Stith,2014,Hampton General District Court
Hon Rondelle D. Herman,2014,Henrico Juvenile and Domestic Relations District Court
Hon Gary A. Hicks,2014,Henrico Circuit Court
Hon Cheryl V. Higgins,2014,Albemarle Circuit Court
Hon Elizabeth S. Hodges,2014,Virginia Beach General District Court
Hon Shannon O. Hoehl,2014,Hanover Juvenile and Domestic Relations District Court
Hon Lauri D. Hogge,2014,Norfolk Juvenile and Domestic Relations District Court
Hon Roxie O. Holder,2014,Portsmouth General District Court
Hon Thomas B. Hoover,2014,New Kent Circuit Court
Hon W. Dale Houff,2014,Page General District Court
Hon Stephen Ashton Hudgins,2014,York General District Court
Hon Tracy Calvin Hudson,2014,Prince William General District Court
Hon Glen A. Huff,2014,Court of Appeals of Virginia
Hon Melvin R. Hughes Jr.,2014,Richmond Circuit Court
Hon Robert J. Humphreys,2014,Court of Appeals of Virginia
Hon Dennis Lee Hupp,2014,Shenandoah Circuit Court
Hon Jack S. Hurley Jr.,2014,Tazewell Circuit Court
Hon Keith Nelson Hurley,2014,Chesterfield General District Court
Hon Pamela E. Hutchens,2014,Virginia Beach General District Court
Hon Christopher W. Hutton,2014,Hampton Circuit Court
Hon Salvatore R. Iaquinto,2014,Virginia Beach General District Court
Hon Philip J. Infantino III,2014,Chesapeake General District Court
Hon Michael S. Irvine,2014,Rockbridge Circuit Court
Hon Gwendolyn J. Jackson,2014,"811 East City Hall Avenue, Room 183"
Hon Avelina S. Jacob,2014,Loudoun Juvenile and Domestic Relations District Court
Hon Birdie Hairston Jamison,2014,Richmond-Traffic General District Court
Hon William E. Jarvis,2014,Prince William General District Court
Hon C. N. Jenkins Jr.,2014,Richmond Circuit Court
Hon Julian W. Johnson,2014,Stafford Juvenile and Domestic Relations District Court
Hon Patrick R. Johnson,2014,Buchanan Circuit Court
Hon Randall G. Johnson Jr.,2014,Henrico Juvenile and Domestic Relations District Court
Hon Sage B. Johnson,2014,Bristol Circuit Court
Hon Craig D. Johnston,2014,Prince William Circuit Court
Hon Bonnie L. Jones,2014,Hampton Circuit Court
Hon George A. Jones Jr.,2014,Pittsylvania General District Court
Hon Jerrauld C. Jones,2014,Norfolk Circuit Court
Hon Brett A. Kassabian,2014,Fairfax Circuit Court
Hon Michael R. Katchmark,2014,Chesapeake General District Court
Hon Thomas J. Kelley Jr.,2014,1425 North Courthouse Road
Hon Patricia   Kelly,2014,Spotsylvania Circuit Court
Hon D. Arthur Kelsey,2014,Court of Appeals of Virginia
Hon Lisa Bondareff Kemler,2014,Alexandria Circuit Court
Hon Richard C. Kerns,2014,Newport News-Traffic General District Court
Hon John C. Kilgore,2014,Scott Circuit Court
Hon Colleen K. Killilea,2014,Williamsburg/James City County General District Court
Hon Cynthia D. Kinser,2014,Supreme Court of Virginia
Hon Judith Anne Kline,2014,Newport News Juvenile and Domestic Relations District Court
Hon Lawrence L. Koontz Jr.,2014,Supreme Court of Virginia
Hon Elizabeth B. Lacy,2014,Supreme Court of Virginia
Hon Daniel Roger Lahne,2014,Virginia Beach General District Court
Hon Nathan Curtis Lee,2014,Prince George Circuit Court
Hon Helen   Leiner,2014,Fairfax County Juvenile and Domestic Relations District Court
Hon Donald W. Lemons,2014,Supreme Court of Virginia
Hon Michael E. Levy,2014,Stafford Circuit Court
Hon R. Larry Lewis,2014,Lee General District and Juvenile and Domestic Relations District Court
Hon W. Revell Lewis III,2014,Accomack Circuit Court
Hon Leslie L. Lilley,2014,Virginia Beach Circuit Court
Hon Vincent A. Lilley,2014,Roanoke County General District Court
Hon William H. Logan Jr.,2014,"215 Mill Rd., Suite 228"
Hon Barry G. Logsdon,2014,Newport News Juvenile and Domestic Relations District Court
Hon Marcus H. Long Jr.,2014,Pulaski Circuit Court
Hon C. Randall Lowe,2014,Washington Circuit Court
Hon Victor V. Ludwig,2014,Augusta Circuit Court
Hon Ray P. Lupold III,2014,Petersburg General District Court
Hon Jonathan S. Lynn,2014,Fauquier Juvenile and Domestic Relations District Court
Hon Stephen C. Mahan,2014,Virginia Beach Circuit Court
Hon Joan E. Mahoney,2014,Norfolk General District Court
Hon Mary B. Malveaux,2014,Henrico General District Court
Hon Thomas P. Mann,2014,Fairfax County Juvenile and Domestic Relations District Court
Hon John   Marshall,2014,Henrico General District Court
Hon Everett A. Martin Jr.,2014,Norfolk Circuit Court
Hon Joseph P. Massey,2014,Norfolk Juvenile and Domestic Relations District Court
Hon Alfred O. Masters Jr.,2014,Newport News-Traffic General District Court
Hon Charles James Maxfield,2014,Fairfax Circuit Court
Hon Lisa A. Mayne,2014,Fairfax County General District Court
Hon Burke F. McCahill,2014,Loudoun Circuit Court
Hon Steven Colin McCallum,2014,Chesterfield Circuit Court
Hon Elizabeth A. McClanahan,2014,Supreme Court of Virginia
Hon Richard J. McCue,2014,Arlington General District Court
Hon Stephen R. McCullough,2014,Court of Appeals of Virginia
Hon Donald P. McDonough,2014,Fairfax County General District Court
Hon Tammy S. McElyea,2014,Wise Circuit Court
Hon Michael E. McGinty,2014,Williamsburg/James City County Circuit Court
Hon R. Michael McKenney,2014,Richmond County General District and Juvenile and Domestic Relations District Court
Hon V. Blake McKinney,2014,Washington General District Court
Hon Kenneth R. Melvin,2014,Portsmouth Circuit Court
Hon Joseph A. Migliozzi Jr.,2014,"811 East City Hall Avenue, Room 183"
Hon Joseph W. Milam Jr.,2014,Danville Circuit Court
Hon LeRoy F. Millette Jr.,2014,Supreme Court of Virginia
Hon Gary A. Mills,2014,Newport News-Civil General District Court
Hon William C. Mims,2014,Supreme Court of Virginia
Hon William J. Minor Jr.,2014,Fairfax County General District Court
Hon John Gregory Mooney,2014,Alleghany General District and Juvenile and Domestic Relations District Court
Hon Becky J. Moore,2014,Alexandria General District Court
Hon James A. Moore,2014,Suffolk General District Court
Hon Michael Lee Moore,2014,Russell Circuit Court
Hon Richard E. Moore,2014,Albemarle Juvenile and Domestic Relations District Court
Hon William S. Moore Jr.,2014,Portsmouth Juvenile and Domestic Relations District Court
Hon Stacey W. Moreau,2014,Pittsylvania Circuit Court
Hon Johnny E. Morrison,2014,Portsmouth Circuit Court
Hon Robert H. Morrison,2014,Halifax Juvenile and Domestic Relations District Court
Hon Mitchell I. Mutnick,2014,Fairfax County General District Court
Hon Ronald Lewis Napier,2014,Warren Juvenile and Domestic Relations District Court
Hon S. Anderson Nelson,2014,Mecklenburg Juvenile and Domestic Relations District Court
Hon William T. Newman Jr.,2014,Arlington Circuit Court
Hon R. Terrence Ney,2014,Fairfax Circuit Court
Hon Lorraine   Nordlund,2014,Fairfax Circuit Court
Hon Pamela   O'Berry,2014,Chesterfield General District Court
Hon Mary Grace O'Brien,2014,Prince William Circuit Court
Hon R. Frances O'Brien,2014,1425 North Courthouse Road
Hon William R. O'Brien,2014,Virginia Beach Circuit Court
Hon James J. O'Connell III,2014,Chesterfield General District Court
Hon Hugh David O'Donnell,2014,Harrisonburg/Rockingham Juvenile and Domestic Relations District Court
Hon Ian M. O'Flaherty,2014,Fairfax County General District Court
Hon Eileen Anita Olds,2014,Chesapeake Juvenile and Domestic Relations District Court
Hon Leslie M. Osborn,2014,Mecklenburg Circuit Court
Hon Douglas B. Ottinger,2014,Portsmouth General District Court
Hon H. Thomas Padrick Jr.,2014,Virginia Beach Circuit Court
Hon Jeffrey W. Parker,2014,Fauquier Circuit Court
Hon Albert W. Patrick III,2014,Hampton General District Court
Hon Richard C. Patterson,2014,Tazewell General District Court
Hon Deborah M. Paxson,2014,Virginia Beach Juvenile and Domestic Relations District Court
Hon H. Cary Payne,2014,Lynchburg Juvenile and Domestic Relations District Court
Hon David F. Peterson,2014,Fredericksburg Juvenile and Domestic Relations District Court
Hon William G. Petty,2014,Court of Appeals of Virginia
Hon Clarence E. Phillips,2014,Wise/Norton General District Court
Hon Kurt J. Pomrenke,2014,Bristol Juvenile and Domestic Relations District Court
Hon Richard Bowen Potter,2014,Prince William Circuit Court
Hon Cleo E. Powell,2014,Supreme Court of Virginia
Hon Florence A. Powell,2014,Washington Juvenile and Domestic Relations District Court
Hon David F. Pugh,2014,Newport News Circuit Court
Hon Deborah L. Rawls,2014,Virginia Beach Juvenile and Domestic Relations District Court
Hon James J. Reynolds,2014,Danville Circuit Court
Hon Sarah A. Rice,2014,Franklin County Juvenile and Domestic Relations District Court
Hon Charles L. Ricketts III,2014,Staunton Circuit Court
Hon J. David Rigler,2014,Chesterfield Juvenile and Domestic Relations District Court
Hon Ricardo   Rigual,2014,Spotsylvania General District Court
Hon Edward A. Robbins Jr.,2014,Chesterfield Juvenile and Domestic Relations District Court
Hon Angela Edwards Roberts,2014,Richmond Juvenile and Domestic Relations District Court
Hon Frederick G. Rockwell III,2014,Chesterfield Circuit Court
Hon Deborah S. Roe,2014,Hampton Juvenile & Domestic Relations District Court
Hon Jane Marum Roush,2014,Fairfax Circuit Court
Hon Gregory L. Rupe,2014,Richmond Circuit Court
Hon Charles S. Russell,2014,Supreme Court of Virginia
Hon Robert H. Sandwich Jr.,2014,Suffolk Circuit Court
Hon Timothy K. Sanner,2014,Louisa Circuit Court
Hon Carson E. Saunders Jr.,2014,Greensville General District and Juvenile and Domestic Relations District Court
Hon Gordon F. Saunders,2014,"20 South Randolph Street, Suite 200"
Hon Janine M. Saxe,2014,Fairfax County Juvenile and Domestic Relations District Court
Hon David Stanford Schell,2014,Fairfax Circuit Court
Hon Charles S. Sharp,2014,Stafford Circuit Court
Hon William W. Sharp,2014,Warren Juvenile and Domestic Relations District Court
Hon W. Allan Sharrett,2014,Greensville Circuit Court
Hon Jeffrey W. Shaw,2014,Mathews General District Court
Hon A. Bonwill Shockley,2014,Virginia Beach Circuit Court
Hon Josiah T. Showalter Jr.,2014,Wythe Circuit Court
Hon Deanis L. Simmons,2014,Smyth Circuit Court
Hon Mark C. Simmons,2014,Fairfax County General District Court
Hon Stephen E. Sincavage,2014,Loudoun Circuit Court
Hon Dennis J. Smith,2014,Fairfax Circuit Court
Hon Randall D. Smith,2014,Chesapeake Circuit Court
Hon Robert J. Smith,2014,Fairfax Circuit Court
Hon Steven S. Smith,2014,Prince William General District Court
Hon Beverly W. Snukals,2014,Richmond Circuit Court
Hon Denis F. Soden,2014,Henrico Juvenile and Domestic Relations District Court
Hon Frank W. Somerville,2014,Orange General District and Juvenile and Domestic Relations District Court
Hon Thomas P. Sotelo,2014,Fairfax County Juvenile and Domestic Relations District Court
Hon Valentine W. Southall Jr.,2014,Amelia General District and Juvenile and Domestic Relations District Court
Hon Margaret P. Spencer,2014,Richmond Circuit Court
Hon John R. Stevens,2014,Fredericksburg General District Court
Hon L. Neil Steverson,2014,Henrico General District Court
Hon M. Lee Stilwell Jr.,2014,Danville General District Court
Hon J. Bruce Strickland,2014,Stafford General District Court
Hon Bryant L. Sugg,2014,Newport News-Criminal General District Court
Hon Georgia K. Sutton,2014,Spotsylvania Juvenile and Domestic Relations District Court
Hon James R. Swanson,2014,Roanoke County Circuit Court
Hon Jacqueline F. Ward Talevi,2014,Roanoke County General District Court
Hon Harry T. Taliaferro III,2014,Richmond County Circuit Court
Hon Alfreda   Talton-Harris,2014,Suffolk Juvenile and Domestic Relations District Court
Hon Joi Jeter Taylor,2014,Richmond-Civil General District Court
Hon Richard D. Taylor Jr.,2014,Richmond Circuit Court
Hon Wilford   Taylor Jr.,2014,Hampton Circuit Court
Hon C. Peter Tench,2014,Newport News Circuit Court
Hon Eric R. Thiessen,2014,Smyth General District Court
Hon Tracy W. J. Thorne-Begland,2014,Richmond-Traffic General District Court
Hon Amy B. Tisinger,2014,215 Mill Road
Hon Winship C. Tower,2014,Virginia Beach Juvenile and Domestic Relations District Court
Hon John M. Tran,2014,Fairfax Circuit Court
Hon Philip   Trompeter,2014,Roanoke County Juvenile and Domestic Relations District Court
Hon Malfourd W. Trumbo,2014,Botetourt Circuit Court
Hon Paul A. Tucker,2014,Botetourt General District and Juvenile and Domestic Relations District Court
Hon Ashley K. Tunner,2014,Richmond Juvenile and Domestic Relations District Court
Hon Robert M. D. Turk,2014,Montgomery Circuit Court
Hon Brian H. Turpin,2014,Pittsylvania Juvenile and Domestic Relations District Court
Hon James W. Updike Jr.,2014,Bedford Circuit Court
Hon Joseph A. Vance IV,2014,Stafford Juvenile and Domestic Relations District Court
Hon Henry A. Vanover,2014,Dickenson Circuit Court
Hon George D. Varoutsos,2014,Arlington Juvenile and Domestic Relations District Court
Hon Thomas L. Vaughn,2014,Chesterfield General District Court
Hon Robert C. Viar Jr.,2014,Montgomery Juvenile and Domestic Relations District Court
Hon Gordon S. Vincent,2014,Accomack General District Court
Hon Richard S. Wallerstein Jr.,2014,Henrico Circuit Court
Hon Charles H. Warren,2014,Mecklenburg General District Court
Hon J. William   Watson Jr.,2014,Halifax General District Court
Hon Jacqueline R. Waymack,2014,Prince George General District and Juvenile and Domestic Relations District Court
Hon Clifford R. Weckstein,2014,Roanoke City Circuit Court
Hon Carroll A. Weimer,2014,Prince William Circuit Court
Hon Janice Justina Wellington,2014,Prince William Juvenile and Domestic Relations District Court
Hon Deborah C. Welsh,2014,Loudoun General District Court
Hon John E. Wetsel Jr.,2014,Frederick Circuit Court
Hon David Shaw Whitacre,2014,Frederick/Winchester General District Court
Hon A. Ellen White,2014,Campbell Juvenile & Domestic Relations District Court
Hon Bruce D. White,2014,Fairfax Circuit Court
Hon Kimberley S. White,2014,Prince Edward Circuit Court
Hon Susan L. Whitlock,2014,Culpeper Circuit Court
Hon Morton V. Whitlow,2014,Portsmouth General District Court
Hon Esther L. Wiggins,2014,Arlington Juvenile and Domestic Relations District Court
Hon Bruce A. Wilcox,2014,Norfolk General District Court
Hon Dale M. Wiley,2014,Danville Juvenile and Domestic Relations District Court
Hon David V. Williams,2014,Henry Circuit Court
Hon David L. Williams,2014,Chesapeake General District Court
Hon Gino W. Williams,2014,Montgomery General District Court
Hon Stuart L. Williams Jr.,2014,Henrico Juvenile and Domestic Relations District Court
Hon William P. Williams,2014,Norfolk Juvenile and Domestic Relations District Court
Hon Alotha C. Willis,2014,Portsmouth Juvenile and Domestic Relations District Court
Hon Gordon F. Willis,2014,Fredericksburg Circuit Court
Hon Larry D. Willis Sr.,2014,Chesapeake Juvenile and Domestic Relations District Court
Hon Elizabeth S. Wills,2014,Wise Juvenile and Domestic Relations District Court
Hon Robert B. Wilson V,2014,Hampton Juvenile & Domestic Relations District Court
Hon Thomas J. Wilson IV,2014,Rockingham Circuit Court
Hon Robert G. Woodson Jr.,2014,Cumberland General District and Juvenile and Domestic Relations District Court
Hon Gene A. Woolard,2014,Virginia Beach General District Court
Hon Dean S. Worcester,2014,Loudoun General District Court
Hon Claude V. Worrell,2014,Albemarle Juvenile and Domestic Relations District Court
Hon Timothy S. Wright,2014,Chesapeake General District Court
Hon F. Patrick Yeatts,2014,Lynchburg Circuit Court
Hon James Stephen Yoffy,2014,Henrico Circuit Court
,2014,Unknown
Hon Samuel H. Cooper Jr.,2014,Accomack Circuit Court
Hon Debra Shipp,2014,Albemarle Circuit Court
Hon Edward Semonian Jr.,2014,Alexandria Circuit Court
Hon Debra N. Byer,2014,Alleghany Circuit Court
Hon Marilyn Wilson,2014,Amelia Circuit Court
Hon Roy C. Mayo III,2014,Amherst Circuit Court
Hon Janet A. Hix,2014,Appomattox Circuit Court
Hon Paul F. Ferguson,2014,Arlington Circuit Court
Hon John B. Davis,2014,Augusta Circuit Court
Hon M. Wayne Winebriner,2014,Bath Circuit Court
Hon Cathy C. Hogan,2014,Bedford Circuit Court
Hon Rebecca I. Johnson,2014,Bland Circuit Court
Hon Tommy L. Moore,2014,Botetourt Circuit Court
Hon Kelly F. Duffy,2014,Bristol Circuit Court
Hon V. Earl Stanley Jr.,2014,Brunswick Circuit Court
Hon Beverly S. Tiller,2014,Buchanan Circuit Court
Hon Malcolm Booker Jr.,2014,Buckingham Circuit Court
Hon Christopher W. Coleman,2014,Buena Vista Circuit Court
Hon Sheila Bosiger,2014,Campbell Circuit Court
Hon Ray S. Campbell Jr.,2014,Caroline Circuit Court
Hon Carolyn H. Honeycutt,2014,Carroll Circuit Court
Hon Edith K. Holmes,2014,Charles City Circuit Court
Hon Stuart B. Fallen,2014,Charlotte Circuit Court
Hon Llezelle Agustin Dugger,2014,Charlottesville Circuit Court
Hon Faye W. Mitchell,2014,Chesapeake Circuit Court
Hon Mary E. Craze,2014,Chesterfield Circuit Court
Hon Helen Butts,2014,Clarke Circuit Court
Hon Stacy L. Stafford,2014,Colonial Heights Circuit Court
Hon Sharon P. Oliver,2014,Craig Circuit Court
Hon Janice J. Corbin,2014,Culpeper Circuit Court
Hon Sarah A. Spry,2014,Cumberland Circuit Court
Hon Gerald A. Gibson,2014,Danville Circuit Court
Hon Richard W. Edwards,2014,Dickenson Circuit Court
Hon John B. Chappell Jr.,2014,Dinwiddie Circuit Court
Hon Gayle Ashworth,2014,Essex Circuit Court
Hon John T. Frey,2014,Fairfax Circuit Court
Hon Gail H. Barb,2014,Fauquier Circuit Court
Hon Wendell G. Peters,2014,Floyd Circuit Court
Hon Bouson E. Peterson Jr.,2014,Fluvanna Circuit Court
Hon Teresa J. Brown,2014,Franklin Circuit Court
Hon Rebecca P. Hogan,2014,Frederick Circuit Court
Hon Jeff Small,2014,Fredericksburg Circuit Court
Hon Charles L. Fraley III,2014,Giles Circuit Court
Hon Margaret F. Walker,2014,Gloucester Circuit Court
