Judge,Year,Court
Hon William H. Shaw III,2008,P.O. Box 576
Hon Louis Allen Sherman,2008,Norfolk Circuit Court
Hon A. Bonwill Shockley,2008,Virginia Beach Circuit Court
Hon Josiah T. Showalter Jr.,2008,Wythe Circuit Court
Hon Charles F. Sievers,2008,Prince William General District Court
Hon Mark C. Simmons,2008,Fairfax County General District Court
Hon Robert L. Simpson Jr.,2008,Virginia Beach General District Court
Hon Lorraine Nordlund Skipper,2008,Fairfax County General District Court
Hon N. Prentis Smiley Jr.,2008,York County Poquoson Circuit Court
Hon Dennis J. Smith,2008,Fairfax Circuit Court
Hon Randall D. Smith,2008,Chesapeake Circuit Court
Hon Robert J. Smith,2008,Fairfax Circuit Court
Hon Beverly W. Snukals,2008,Richmond Circuit Court
Hon Denis F. Soden,2008,Henrico Juvenile & Domestic Relations District Court
Hon Frank W. Somerville,2008,Orange General District and J&DR District Court
Hon Thomas P. Sotelo,2008,Fairfax County Juvenile & Domestic Relations District Court
Hon Valentine W. Southall Jr.,2008,Amelia General District and J&DR District Court
Hon Margaret P. Spencer,2008,Richmond Circuit Court
Hon Peter W. Steketee,2008,Prince William General District Court
Hon Roscoe B. Stephenson Jr.,2008,Supreme Court of Virginia
Hon John R. Stevens,2008,Fredericksburg General District Court
Hon L. Neil Steverson,2008,Henrico General District Court
Hon M. Lee Stilwell Jr.,2008,Danville General District Court
Hon Walter W. Stout III,2008,Richmond Circuit Court
Hon Charles J. Strauss,2008,P.O. Box 1042
Hon Bryant L. Sugg,2008,2500 Washington Avenue
Hon James R. Swanson,2008,305 East Main Street
Hon Dean W. Sword Jr.,2008,Portsmouth Circuit Court
Hon Jacqueline F. Ward Talevi,2008,Roanoke County General District Court
Hon Harry T. Taliaferro III,2008,Richmond County Circuit Court
Hon Alfreda   Talton-Harris,2008,Suffolk Juvenile & Domestic Relations District Court
Hon Joseph S. Tate,2008,Smyth General District Court
Hon Joi Jeter Taylor,2008,Richmond-Civil General District Court
Hon Ramona D. Taylor,2008,Virginia Beach Juvenile & Domestic Relations District Court
Hon Richard D. Taylor Jr.,2008,Richmond Circuit Court
Hon Wilford   Taylor Jr.,2008,Hampton Circuit Court
Hon C. Peter Tench,2008,2500 Washington Avenue
Hon Jonathan C. Thacher,2008,Fairfax Circuit Court
Hon Norman A. Thomas,2008,Norfolk Circuit Court
Hon Winship C. Tower,2008,Virginia Beach Juvenile & Domestic Relations District Court
Hon Wenda K. Travers,2008,Prince William General District Court
Hon Peter L. Trible,2008,Hanover General District Court
Hon Philip   Trompeter,2008,Roanoke County Juvenile & Domestic Relations District Court
Hon Malfourd W. Bo Trumbo,2008,Alleghany Circuit Court
Hon Paul A. Tucker,2008,Botetourt General District and J&DR District Court
Hon Ashley K. Tunner,2008,Richmond Juvenile & Domestic Relations District Court
Hon Robert M. D. Turk,2008,"One East Main Street, Room 409"
Hon Edward M. Turner III,2008,Carroll General District Court
Hon Glen A. Tyler,2008,Accomack Circuit Court
Hon James W. Updike Jr.,2008,Bedford Circuit Court
Hon Henry A. Vanover,2008,Dickenson Circuit Court
Hon George D. Varoutsos,2008,Arlington Juvenile & Domestic Relations District Court
Hon Thomas L. Vaughn,2008,Chesterfield General District Court
Hon Robert C. Viar Jr.,2008,Radford General District and J&DR District Court
Hon Gordon S. Vincent,2008,Accomack General District Court
Hon Philip Arthur Wallace,2008,Bedford Juvenile & Domestic Relations District Court
Hon Richard S. Wallerstein Jr.,2008,Henrico Juvenile & Domestic Relations District Court
Hon Charles H. Warren,2008,Mecklenburg General District Court
Hon Junius P. Warren,2008,P. O. Box 751
Hon Thomas V. Warren,2008,P.O. Box 62
Hon Jacqueline R. Waymack,2008,Prince George General District and J&DR District Court
Hon Clifford R. Weckstein,2008,P.O. Box 211
Hon Janice Justina Wellington,2008,Prince William Juvenile & Domestic Relations District Court
Hon William L. Wellons,2008,Lunenburg Circuit Court
Hon Patricia L. West,2008,Virginia Beach Circuit Court
Hon John E. Wetsel Jr.,2008,Frederick Circuit Court
Hon David Shaw Whitacre,2008,Frederick/Winchester General District Court
Hon A. Ellen White,2008,Camp;bell Juvenile & Domestic Relations District Court
Hon Bruce D. White,2008,Fairfax Circuit Court
Hon Colon H. Whitehurst,2008,Chesapeake General District Court
Hon Susan L. Whitlock,2008,Louisa General District and J&DR District Court
Hon Morton V. Whitlow,2008,Portsmouth General District Court
Hon Bruce A. Wilcox,2008,Norfolk General District Court
Hon Dale M. Wiley,2008,Danville Juvenile & Domestic Relations District Court
Hon Gordon A. Wilkins,2008,Westmoreland General District Court
Hon Sharon B. Will,2008,Henrico Juvenile & Domestic Relations District Court
Hon David V. Williams,2008,Henry Circuit Court
Hon David L. Williams,2008,Chesapeake General District Court
Hon Gino W. Williams,2008,Montgomery General District Court
Hon Marcus D. Williams,2008,Fairfax Circuit Court
Hon Stuart L. Williams Jr.,2008,Henrico Juvenile & Domestic Relations District Court
Hon William P. Williams,2008,Norfolk Juvenile & Domestic Relations District Court
Hon Alotha C. Willis,2008,Portsmouth Juvenile & Domestic Relations District Court
Hon Gordon F. Willis,2008,Stafford Circuit Court
Hon Jere M.H. Willis Jr.,2008,Court of Appeals of Virginia
Hon Larry D. Willis Sr.,2008,Chesapeake Juvenile & Domestic Relations District Court
Hon Elizabeth S. Wills,2008,Wise Juvenile & Domestic Relations District Court
Hon Robert B. Wilson V,2008,Hamp;ton Juvenile & Domestic Relations District Court
Hon Thomas J. Wilson IV,2008,Rockingham Circuit Court
Hon Robert G. Woodson Jr.,2008,Cumberland General District and J&DR District Court
Hon Gene A. Woolard,2008,Virginia Beach General District Court
Hon Dean S. Worcester,2008,Loudoun General District Court
Hon Timothy S. Wright,2008,Chesapeake General District Court
Hon Archer L. Yeatts III,2008,Henrico General District Court
Hon F. Patrick Yeatts,2008,Campbell General District Court
Hon James Stephen Yoffy,2008,Henrico General District Court
,2008,Unknown
Hon Wendell G. Peters,2008,Floyd Circuit Court
Hon Robert C. Wrenn,2008,Greensville Circuit Court
Hon Bevill M. Dean,2008,Richmond Circuit Court
Hon Teresa J. Brown,2008,Franklin Circuit Court
Hon Mark A. (Bo) Taylor,2008,Scott Circuit Court
Hon Deborah F. Longest,2008,King and Queen Circuit Court
Hon Gerald A. Gibson,2008,Danville Circuit Court
Hon Terry H. Whittle,2008,Winchester Circuit Court
Hon Rebecca P. Hogan,2008,Frederick Circuit Court
Hon Kay H. Rackley,2008,Hopewell Circuit Court
Hon Michele B. McQuigg,2008,Prince William Circuit Court
Hon Rebecca I. Johnson,2008,Bland Circuit Court
Hon Barbara G. Decatur,2008,Stafford Circuit Court
Hon Benjamin O. Scott,2008,Petersburg Circuit Court
Hon Gayle Ashworth,2008,Essex Circuit Court
Hon Ann Sword McReynolds,2008,Russell Circuit Court
Hon Brenda S. Hamilton,2008,Roanoke City Circuit Court
Hon Beverly S. Tiller,2008,Buchanan Circuit Court
Hon Richard W. Edwards,2008,Dickenson Circuit Court
Hon Gary M. Williams,2008,Sussex Circuit Court
Hon Linda Booth,2008,Northumberland Circuit Court
Hon Roy C. Mayo III,2008,Amherst Circuit Court
Hon Jennifer R. Sims,2008,Warren Circuit Court
Hon Barbara R. Williams,2008,Appomattox Circuit Court
Hon Samuel H. Cooper Jr.,2008,Accomack Circuit Court
Hon Sharon N. Jones,2008,Isle of Wight Circuit Court
Hon Ray S. Campbell Jr.,2008,Caroline Circuit Court
Hon Susan R. Hopkins,2008,Louisa Circuit Court
Hon Lois S. Ralston,2008,Highland Circuit Court
Hon Nicole A. Briggs,2008,Waynesboro Circuit Court
Hon W. R. Carter Jr.,2008,Suffolk Circuit Court
Hon Larry B. Palmer,2008,Lynchburg Circuit Court
Hon Patricia S. Phipps,2008,Washington Circuit Court
Hon Cynthia P. Morrison,2008,Portsmouth Circuit Court
Hon Susan C. Gasperini,2008,Patrick Circuit Court
Hon Carolyn H. Honeycutt,2008,Carroll Circuit Court
Hon Linda S. Timmons,2008,Orange Circuit Court
Hon Lee G. Turner,2008,Goochland Circuit Court
Hon Paul C. Garrett,2008,Charlottesville Circuit Court
Hon E. E. Callis III,2008,Mathews Circuit Court
Hon Stuart B. Fallen,2008,Charlotte Circuit Court
Hon Rex A. Davis,2008,Newport News Circuit Court
Hon Gail H. Barb,2008,Fauquier Circuit Court
Hon Machelle J. Eppes,2008,Prince Edward Circuit Court
Hon George E. Schaefer,2008,Norfolk Circuit Court
Hon John B. Davis,2008,Augusta Circuit Court
Hon Judy Stevens Smythers,2008,Nelson Circuit Court
Hon Gail P. Clayton,2008,Surry Circuit Court
Hon C. L. Fraley III,2008,Giles Circuit Court
Hon Sharron S. Mitchell,2008,Fredericksburg Circuit Court
Hon Hayden H. Horney,2008,Wythe Circuit Court
Hon Stacy L. Stafford,2008,Colonial Heights Circuit Court
Hon Faye W. Mitchell,2008,Chesapeake Circuit Court
Hon Diane Bruce,2008,Rappahannock Circuit Court
Hon Zelda S. Vaughn,2008,Radford Circuit Court
Hon Beverly R. Anderson,2008,Lee Circuit Court
Hon Judy L. Worthington,2008,Chesterfield Circuit Court
Hon Carol Ownby,2008,Cumberland Circuit Court
Hon Patricia M. Norman,2008,King William Circuit Court
Ms Traci L. Johnson,2008,Northampton Circuit Court
Hon Janice J. Corbin,2008,Culpeper Circuit Court
Hon Chaz W. Evans-Haywood,2008,Rockingham Circuit Court
Hon Lynn S. Mendibur,2008,York County Poquoson Circuit Court
Hon Peggy A. Bostic,2008,Craig Circuit Court
Hon Susan M. Herrington,2008,Grayson Circuit Court
Hon Bishop Knott Jr.,2008,Prince George Circuit Court
Hon Marilyn Wilson,2008,Amelia Circuit Court
Hon James E. Blevins,2008,Tazewell Circuit Court
Hon John T. Frey,2008,Fairfax Circuit Court
Hon D. Bruce Patterson,2008,Rockbridge Circuit Court
Hon Steven A. McGraw Sr.,2008,Roanoke County Circuit Court
Hon Tina E. Sinnen,2008,Virginia Beach Circuit Court
Hon Paul F. Ferguson,2008,Arlington Circuit Court
Hon Edward Semonian Jr.,2008,Alexandria Circuit Court
Hon Jane L. Brown,2008,Nottoway Circuit Court
Hon Margaret F. Walker,2008,Gloucester Circuit Court
Hon Gwynne J. Chatham,2008,Westmoreland Circuit Court
Hon Thomas E. Roberts,2008,Staunton Circuit Court
Hon Chance Crawford,2008,Salem Circuit Court
Hon Malcolm Booker Jr.,2008,Buckingham Circuit Court
Hon John B. Chappell Jr.,2008,Dinwiddie Circuit Court
Hon Frank D. Hargrove Jr.,2008,Hanover Circuit Court
Hon Helen Butts,2008,Clarke Circuit Court
Hon Rosa S. Forrester,2008,Richmond County Circuit Court
Hon Erica W. Williams,2008,Montgomery Circuit Court
Hon Maetta H. Crewe,2008,Pulaski Circuit Court
Hon Christopher W. Coleman,2008,Buena Vista Circuit Court
Hon Linda Batchelor Smith,2008,Hampton Circuit Court
Hon Betsy B. Woolridge,2008,James City County/Williamsburg Circuit Court
Hon C. R. Wilson,2008,Page Circuit Court
Hon E. E. Coleman Jr.,2008,Mecklenburg Circuit Court
Hon Denise F. Barb,2008,Shenandoah Circuit Court
Hon Cathy C. Hogan,2008,Bedford Circuit Court
Hon Gary M. Clemens,2008,Loudoun Circuit Court
Hon Betsy B. Woolridge,2008,Williamsburg/James City County Circuit Court
Hon Christalyn M. Jett,2008,Spotsylvania Circuit Court
Hon William E. Maxey Jr.,2008,Powhatan Circuit Court
Hon H. F. Haymore Jr.,2008,Pittsylvania Circuit Court
Hon Edith K. Holmes,2008,Charles City Circuit Court
Hon Ashby R. Pritchett,2008,Martinsville Circuit Court
Hon M. Wayne Winebriner,2008,Bath Circuit Court
Hon Tommy L. Moore,2008,Botetourt Circuit Court
Hon Debra Shipp,2008,Albemarle Circuit Court
Hon Gordon F. Erby,2008,Lunenburg Circuit Court
Hon Yvonne G. Smith,2008,Henrico Circuit Court
Hon Charles V. Mason,2008,King George Circuit Court
Hon V. Earl Stanley Jr.,2008,Brunswick Circuit Court
Hon Diane H. Mumford,2008,Lancaster Circuit Court
Hon J. Jack Kennedy Jr.,2008,Wise Circuit Court
Hon Terry G. Rohr,2008,Bristol Circuit Court
Hon Richard L. Francis,2008,Southampton Circuit Court
Hon Deborah E. Hughes,2008,Campbell Circuit Court
Hon Debra N. Byer,2008,Alleghany Circuit Court
Hon Vickie Stone Helmstutler,2008,Henry Circuit Court
Hon Bouson E. Peterson Jr.,2008,Fluvanna Circuit Court
Hon Caroline Watts,2008,Madison Circuit Court
Hon Peggy W. Walton,2008,Middlesex Circuit Court
Hon Marie C. Durrer,2008,Greene Circuit Court
Hon Karen A. Butler,2008,New Kent Circuit Court
Hon Jimmy L. Warren,2008,Smyth Circuit Court
Hon Robert W. Conner,2008,Halifax Circuit Court
Ms Jacqueline Preston Brubaker,2008,Franklin County General District Court
Ms Joyce S. Mitchell,2008,King and Queen General District Court
Ms Bonnie L. Simmons,2008,Harrisonburg/Rockingham General District Court
Ms Julie H. Carlisle,2008,Danville General District Court
Ms Jacqueline R. Ward,2008,Prince William General District Court
Ms Nicole B. McGuire,2008,Stafford General District Court
Ms Joyce A. Street,2008,Petersburg General District Court
Mr Ronald S. Albright,2008,Roanoke City General District Court
Ms Angela W Tadlock,2008,Northumberland General District Court
Ms Beverly J. Lewis,2008,Amherst General District Court
Ms Pamela S. Kidwell,2008,Warren General District Court
Ms Jeanette C. Hamlett,2008,Appomattox General District Court
Ms Francina Violet Chisum,2008,Accomack General District Court
Ms Keith F. Daniel,2008,Isle of Wight General District Court
Ms Terry M. Southworth,2008,Caroline General District Court
Ms Brenda L. Vance,2008,Winchester/Frederick General District Court
Ms Jacqueline Michelle Balderson,2008,Waynesboro General District Court
Ms Brenda C. Brown,2008,Suffolk General District Court
Ms Janet T. Stinnett,2008,Lynchburg General District Court
Ms Edna S. Griffin,2008,Washington General District Court
Ms Lenna J. (Jody) Davis,2008,Portsmouth General District Court
Ms Brenda S. Hines,2008,Patrick General District Court
Ms Donna Janette Webb,2008,Carroll General District Court
Ms Mary Alice Trimble,2008,Charlottesville General District Court
Ms Dorothy Gail Fulcher,2008,Mathews General District Court
Ms Sabrina Herzig Powell,2008,Charlotte General District Court
Ms Melanie H. Stephens,2008,York General District Court
Ms Sandra Cox Blount,2008,Richmond-Civil General District Court
Ms Sandra K. Ramey,2008,Fauquier General District Court
Mr Richard H. Bowling,2008,Richmond-Criminal General District Court
Mr Thomas E. Baldwin Sr.,2008,Norfolk General District Court
Ms Christy D. Hostetter,2008,Augusta General District Court
Ms Rosemary R. North,2008,Nelson General District Court
Mr Royal P. Schmidt Jr.,2008,Fredericksburg General District Court
Ms D. Carol Hamer,2008,Wythe General District Court
Ms Deborah A. Ellington,2008,Chesapeake General District Court
Ms Nancy L. Lake,2008,Fairfax County General District Court
Mr Carlton L. Hudson,2008,Chesterfield General District Court
Ms Joyce S. Mitchell,2008,King William General District Court
Ms Karen Sparrow Merritt,2008,Northampton General District Court
Ms Phyllis P. Williams,2008,Newport News-Traffic General District Court
Ms Denise M. Hain,2008,Newport News-Civil General District Court
Ms Connie S. Comer,2008,Tazewell General District Court
Ms Brenda L. Vance,2008,Frederick/Winchester General District Court
Ms Theresa A. Childress,2008,Roanoke County General District Court
Mr Andre Henry Mayfield,2008,Virginia Beach General District Court
Ms Faye L. Rogers,2008,Newport News-Criminal General District Court
Mr Steven Robert Spurr,2008,Arlington General District Court
Ms JeAnne Victoria Rosson,2008,Alexandria General District Court
Ms Amy S. Pierce,2008,Gloucester General District Court
Ms Jane Carter Branson,2008,Westmoreland General District Court
Ms Nancy J. Long,2008,Staunton General District Court
Ms Page B. Wright,2008,Hanover General District Court
Mr David Michael Hicks,2008,Richmond Manchester General District Court
Ms Monica A. Christian,2008,Clarke General District Court
,2008,Montgomery General District Court
Ms Terri Powers,2008,Pulaski General District Court
Ms Pamela M. Meadows,2008,Hampton General District Court
Mr Kevin W. Bailey,2008,Fairfax City General District Court
Mr Irving C. Wright,2008,Richmond-Traffic General District Court
Ms Tammy Tollerson Taylor,2008,Mecklenburg General District Court
Ms Nicole G Dinges,2008,Page General District Court
Ms Carla F. Smith,2008,Bedford General District Court
Ms Tamara L. Heishman,2008,Shenandoah General District Court
Ms Judith S. Waddell,2008,Loudoun General District Court
Ms Brenda T. Sumner,2008,Williamsburg/James City County General District Court
Ms Kyra Lynn Bullock,2008,Spotsylvania General District Court
Ms Opal R. Hall,2008,Martinsville General District Court
Ms Jacqueline Preston Brubaker,2008,Pittsylvania General District Court
Ms Phyllis L. Stewart,2008,Albemarle General District Court
Mr Lawrence George Sprader,2008,Henrico General District Court
Ms Faye R. Smith,2008,Lancaster General District Court
Ms Jean C. Sparks,2008,Wise/Norton General District Court
Mrs Paula Jean Perkins,2008,Bristol General District Court
Ms Katherine L. Mason,2008,Campbell General District Court
Ms Opal R. Hall,2008,Henry General District Court
Ms Dorothy Gail Fulcher,2008,Middlesex General District Court
Ms Jeanne Bennett Allen,2008,New Kent General District Court
Ms Heidi Zumpf Campbell,2008,Smyth General District Court
Ms Veresia W. Coleman,2008,Halifax General District Court
Ms Billie Jo Wagner,2008,Franklin County Juvenile & Domestic Relations District Court
Ms Laura Elizabeth Gardner,2008,Richmond Juvenile & Domestic Relations District Court
Ms Janet T. Gallaher,2008,King and Queen Juvenile & Domestic Relations District Court
Ms Phyllis M. Modisett,2008,Harrisonburg/Rockingham Juvenile & Domestic Relations District Court
Ms Donna C. Hyler,2008,Danville Juvenile & Domestic Relations District Court
Ms Frances H. Hedrick,2008,Prince William Juvenile & Domestic Relations District Court
Mr James Bruce Thompson,2008,Stafford Juvenile & Domestic Relations District Court
Ms Beneatha B. Simmons,2008,Petersburg Juvenile & Domestic Relations District Court
Mr David Carl Wells,2008,Roanoke City Juvenile & Domestic Relations District Court
Ms Dorothy B. Mathers,2008,Northumberland Juvenile & Domestic Relations District Court
Ms Pamela A. Springer,2008,Amherst Juvenile & Domestic Relations District Court
Ms Linda M. Beatty,2008,Warren Juvenile & Domestic Relations District Court
Ms Vickie C. Talbott,2008,Appomattox Juvenile & Domestic Relations District Court
Ms Anne P. Nicholson,2008,Accomack Juvenile & Domestic Relations District Court
Ms Teresa B. Bowden,2008,Isle of Wight Juvenile & Domestic Relations District Court
Ms Terry Jean Andrews,2008,Caroline Juvenile & Domestic Relations District Court
Ms Ann B. Lloyd,2008,Winchester/Frederick Juvenile & Domestic Relations District Court
Ms Phyllis R. Plyler,2008,Waynesboro Juvenile & Domestic Relations District Court
Ms Brenda R. McWilliams,2008,Suffolk Juvenile & Domestic Relations District Court
Ms Heather Dawn Cooper,2008,Lynchburg Juvenile & Domestic Relations District Court
Ms Sue B. Flanagan,2008,Washington Juvenile & Domestic Relations District Court
Ms C. Sue Canady,2008,Portsmouth Juvenile & Domestic Relations District Court
Ms Michele Joyce Bryant,2008,Patrick Juvenile & Domestic Relations District Court
Ms Barbara S. Hamm,2008,Carroll Juvenile & Domestic Relations District Court
Ms Jody Ann Shelley,2008,Charlottesville Juvenile & Domestic Relations District Court
Ms Tiffany R. Sterling,2008,Mathews Juvenile & Domestic Relations District Court
Ms Hilda W. Ferguson,2008,Charlotte Juvenile & Domestic Relations District Court
Ms Margienette J. Whitfield,2008,York Juvenile & Domestic Relations District Court
Ms Patsy A. Ewell,2008,Newport News Juvenile & Domestic Relations District Court
Ms Lois C. Welch,2008,Fauquier Juvenile & Domestic Relations District Court
Ms Debra A. Hill,2008,Norfolk Juvenile & Domestic Relations District Court
Ms Donna Coffey Bosserman,2008,Augusta Juvenile & Domestic Relations District Court
Ms Nancy H. Massie,2008,Nelson Juvenile & Domestic Relations District Court
Ms Joan M. Millward,2008,Fredericksburg Juvenile & Domestic Relations District Court
Ms Karen L. Akers,2008,Wythe Juvenile & Domestic Relations District Court
Ms Lorraine Creef Throckmorton,2008,Chesapeake Juvenile & Domestic Relations District Court
Ms Jennifer W. Flanagan,2008,Fairfax County Juvenile & Domestic Relations District Court
Mr Frank T. Mountford,2008,Chesterfield Juvenile & Domestic Relations District Court
Ms Janet T. Gallaher,2008,King William Juvenile & Domestic Relations District Court
Ms Francine W. Williams,2008,Northampton Juvenile & Domestic Relations District Court
Ms Connie Cheryl Roberts,2008,Tazewell Juvenile & Domestic Relations District Court
Ms Ann B. Lloyd,2008,Frederick/Winchester Juvenile & Domestic Relations District Court
Ms Doris J. Johnson,2008,Roanoke County Juvenile & Domestic Relations District Court
Ms Pamela Dawn Scott,2008,Virginia Beach Juvenile & Domestic Relations District Court
Ms Amy K. Burnham,2008,Arlington Juvenile & Domestic Relations District Court
Mr Christopher Eric Barr,2008,Alexandria Juvenile & Domestic Relations District Court
Ms Tiffany R. Sterling,2008,Gloucester Juvenile & Domestic Relations District Court
Ms S. Lynn Coates,2008,Westmoreland Juvenile & Domestic Relations District Court
Ms Donna Coffey Bosserman,2008,Staunton Juvenile & Domestic Relations District Court
Ms Tracy Lee O'Blinsky,2008,Hanover Juvenile & Domestic Relations District Court
Ms Lisa W McDonald,2008,Clarke Juvenile & Domestic Relations District Court
Ms Connie M. Viar,2008,Montgomery Juvenile & Domestic Relations District Court
Ms Judith C. Childress,2008,Pulaski Juvenile & Domestic Relations District Court
Ms Judith D. Reed,2008,Hampton Juvenile & Domestic Relations District Court
Ms Rebecca D. Inge,2008,Mecklenburg Juvenile & Domestic Relations District Court
Ms Ollie Susan Aleshire,2008,Page Juvenile & Domestic Relations District Court
Ms Stacey T. Arrington,2008,Bedford Juvenile & Domestic Relations District Court
Ms Nikki Wymer Taylor,2008,Shenandoah Juvenile & Domestic Relations District Court
Ms Patricia A. Maher-Wade,2008,Loudoun Juvenile & Domestic Relations District Court
Ms Betty B. Miller,2008,Williamsburg/James City County Juvenile & Domestic Relations District Court
,2008,Spotsylvania Juvenile & Domestic Relations District Court
Ms Teresa D. Renz,2008,Martinsville Juvenile & Domestic Relations District Court
Ms Cynthia Owen Keel,2008,Pittsylvania Juvenile & Domestic Relations District Court
Ms Jody Ann Shelley,2008,Albemarle Juvenile & Domestic Relations District Court
Ms Rebecca Leigh Cone,2008,Henrico Juvenile & Domestic Relations District Court
Ms Dorothy B. Mathers,2008,Lancaster Juvenile & Domestic Relations District Court
Ms V. Jane Dorton,2008,Wise Juvenile & Domestic Relations District Court
Ms Sue B. Flanagan,2008,Bristol Juvenile & Domestic Relations District Court
Ms Dawn C. Williams,2008,Campbell Juvenile & Domestic Relations District Court
Ms Nora A. Green,2008,Henry Juvenile & Domestic Relations District Court
Ms Tiffany R. Sterling,2008,Middlesex Juvenile & Domestic Relations District Court
Ms Kelly Anne Douglas,2008,New Kent Juvenile & Domestic Relations District Court
Ms Dorothy C. Whitt,2008,Smyth Juvenile & Domestic Relations District Court
Ms Catherine H. Ratliff,2008,Halifax Juvenile & Domestic Relations District Court
Ms Judy R. Bell,2008,Floyd Combined District and JD & R Court
Ms Nancy E. Roach,2008,Greensville Combined District and JD & R Court
Ms Lizabeth H. Holdaway,2008,Grayson Combined District and JD & R Court
Ms Kelly A. Pritchett,2008,Craig Combined District and JD & R Court
Ms Ellen Taylor Chiasson,2008,Prince George Combined District and JD & R Court
,2008,Scott Combined District and JD & R Court
Ms Melissa B. Gil,2008,Amelia Combined District and JD & R Court
Ms Edith P. Winters,2008,Hopewell Combined District and JD & R Court
Ms Mary R. Childress,2008,Nottoway Combined District and JD & R Court
Ms Jill G. Baker,2008,Bland Combined District and JD & R Court
Ms Carolyn W. Robbins,2008,Salem Combined District and JD & R Court
Ms Dee Balderson Davis,2008,Essex Combined District and JD & R Court
Ms Kathy F. Vance,2008,Russell Combined District and JD & R Court
Ms Vicki E. Tate,2008,Galax Combined District and JD & R Court
Ms Janice Ann Rife,2008,Buchanan Combined District and JD & R Court
Ms Judy P. Jamerson,2008,Buckingham Combined District and JD & R Court
Ms Sandra B. Sneade,2008,Dinwiddie Combined District and JD & R Court
Ms Deborah R. Childress,2008,Dickenson Combined District and JD & R Court
Ms Frances M. Fountain,2008,Sussex Combined District and JD & R Court
Ms Wanda E. Brownlee,2008,Richmond County Combined District and JD & R Court
Ms Gail O. Proffitt,2008,Louisa Combined District and JD & R Court
Ms Judy W. Hupman,2008,Highland Combined District and JD & R Court
Ms Ginger L. Webb,2008,Buena Vista Combined District and JD & R Court
Ms Nancy E. Roach,2008,Emporia Combined District and JD & R Court
Ms G. M. Blankenship,2008,Powhatan Combined District and JD & R Court
Ms Barbara Jean Watkins,2008,Charles City Combined District and JD & R Court
Ms Sara Belle Byrd Worsham,2008,Bath Combined District and JD & R Court
Ms Barbara B Miller,2008,Orange Combined District and JD & R Court
Mr Steven Wayne Hammock,2008,Lunenburg Combined District and JD & R Court
Ms Bonnie D. Simmons,2008,Botetourt Combined District and JD & R Court
Ms Dianne Henley White,2008,Goochland Combined District and JD & R Court
Ms Nancy Lynn Tierney,2008,King George Combined District and JD & R Court
Ms Kathryn T. Clary,2008,Brunswick Combined District and JD & R Court
Ms Belinda J. Jones,2008,Southampton Combined District and JD & R Court
